,Unnamed: 0,Reply,Upvote,Time,Key,neg,neu,pos,compound
1663,17,"Good , welcome to the cult of Maru . As you see I am Maru 's wife . The annual ritual of praying to Maru will take place behind the gay target .",10.0,2020-08-01 04:42:22,237.0,0.0,0.781,0.219,0.8126
1664,18,Happy anniversary,2.0,2020-08-01 12:47:07,237.0,0.0,0.213,0.787,0.5719
1665,19,"I 'm so sorry , the cult of Sebastian 's meeting is happening in the dark corner of the library on Tuesday and Fridays .",11.0,2020-08-01 04:49:15,237.0,0.068,0.932,0.0,-0.188
1666,20,Thank you I like yours too,2.0,2020-08-01 12:43:15,237.0,0.0,0.444,0.556,0.6124
1667,21,Sweet ! I ’ ll bring the void eggs !,2.0,2020-08-01 08:20:21,237.0,0.0,1.0,0.0,0.0
1668,22,"Thanks , I am bringing the prayer batteries . See you there",2.0,2020-08-01 12:46:04,237.0,0.0,0.791,0.209,0.4404
1669,0,"I think i dont have enough maru points to understand this meme , dont explain i give her gold bars twice a week",3.0,2020-08-01 02:09:21,238.0,0.0,1.0,0.0,0.0
1670,1,I just made this because I thought it was funny . If there is something similar in game I do n't know about it . Sorry for the confusion . I used Maru because 1 I love her and 2 she has the best smile,3.0,2020-08-01 12:56:42,238.0,0.062,0.693,0.245,0.9062
1671,2,"Peck your face of ? I don ’ t think I knew Maru liked chickens , I thought you had to marry Sebastian to get the blue ones ...",1.0,2020-08-01 03:38:53,238.0,0.0,0.909,0.091,0.4215
1672,3,"Agree , no idea what this is a reference to lol",4.0,2020-08-01 02:57:31,238.0,0.142,0.516,0.342,0.4767
1673,4,[ deleted ],1.0,2020-08-01 02:48:39,238.0,0.0,1.0,0.0,0.0
1674,5,I thought it was Shane at 8+ hearts . May be wrong tho I dunno .,3.0,2020-08-01 05:38:15,238.0,0.145,0.654,0.201,0.296
1675,6,"I think the meme is about a heart event that i did n't saw yet , but if it is do n't explain it Better ? Sorry but english is my 3rd language",3.0,2020-08-01 02:51:10,238.0,0.123,0.807,0.07,-0.2404
1676,7,"Could be , could be .",1.0,2020-08-01 05:40:13,238.0,0.0,1.0,0.0,0.0
1677,0,I feel called out,6.0,2020-07-31 22:53:05,239.0,0.0,1.0,0.0,0.0
1678,1,I am so busted,3.0,2020-08-06 07:31:29,239.0,0.0,1.0,0.0,0.0
1679,0,I love how Leah 's heart events are slightly altered depending on the farmer 's gender .,94.0,2020-07-31 03:21:33,241.0,0.0,0.641,0.359,0.8555
1680,1,"I was en-route to marry Sebastian but also had an abundance of amethyst so building friendship with Abigail . Well , after her heart event w/ Pierre I was like well , looks like I have to marry Abigail . I ’ m going to download a mod so I can just marry both of them",39.0,2020-07-31 03:27:16,241.0,0.0,0.758,0.242,0.9556
1681,2,"As a bi , I honestly thought everyone was a lil bi my whole life so this checks out .",42.0,2020-07-31 05:19:15,241.0,0.0,0.864,0.136,0.4588
1682,3,I mean 1 many of them have slightly altered dialogue based on if you ’ re the same gender as them or not But 2 technically only one character is bi/gay in the stardew universe ( universe being the specific game save you ’ re playing ) . Well ..... assuming you only marry one person . If you marry everyone in one playthrough then that ’ s a different story !,7.0,2020-07-31 09:11:34,241.0,0.0,0.912,0.088,0.7777
1683,4,Memuatic,2.0,2020-07-31 09:58:17,241.0,0.0,1.0,0.0,0.0
1684,5,or pan !,2.0,2020-07-31 11:24:19,241.0,0.0,1.0,0.0,0.0
1685,6,"I know that the biggest reason for this was to make it easier for 1 man to program uni-sexual dialogues and romances , but I personally dislike it when everyone is player-sexual . I do n't think any of the marriage candidates showed any bi-sexual desires in their dialogues/interactions prior to romancing the player . I like the approach that Cyberpunk 2077 is taking where there will be NPCs that are specifically lesbian , straight , bi and even if you are of the appropriate gender , you have to be the right body type too ( some will like skinny or chunky body types ) it helps encourage multiple play throughs . Oh well though , I still enjoy playing stardew all day .",1.0,2020-07-31 04:19:38,241.0,0.023,0.757,0.221,0.9809
1686,7,"I love how they did that with her , She 's Either Straight or Gay , depending on you .",54.0,2020-07-31 05:23:29,241.0,0.0,0.747,0.253,0.7269
1687,8,In what way ?,4.0,2020-07-31 07:36:41,241.0,0.0,1.0,0.0,0.0
1688,9,"Have you found one ? Because i had your problem , except i friended Abi after marrying sebi",11.0,2020-07-31 05:24:13,241.0,0.126,0.748,0.126,0.0
1689,10,"Ditto . Outed myself when a friend outed themselves , `` Does n't everybody feel that way ? No ? I guess it 's just us then . ''",14.0,2020-07-31 08:39:04,241.0,0.067,0.824,0.109,0.3313
1690,11,Or pan ! It ’ s just that there ’ s no non binary or genderqueer option in character creation so they are technically bi,1.0,2020-07-31 19:17:09,241.0,0.09,0.834,0.076,-0.1007
1691,12,"I mean , other than Leah who is basically made to be attracted to the sex of the player , I try to honor this .",12.0,2020-07-31 05:18:43,241.0,0.0,0.8,0.2,0.7184
1692,13,This game is meant to foster a sense of community and does that by allowing you to marry any single character . Being able to marry any character is like being able to choose your personality preference like in a dating sim . And if anything some characters are specifically oriented . One of Leah ’ s heart events mentions a female ex .,19.0,2020-07-31 05:03:23,241.0,0.0,0.869,0.131,0.8481
1693,14,Exactly ! Very immersive .,20.0,2020-07-31 05:32:35,241.0,0.0,1.0,0.0,0.0
1694,15,It kinda bugs me as bi erasure . Why can ’ t her ex be the opposite gender ?,7.0,2020-07-31 11:50:09,241.0,0.0,1.0,0.0,0.0
1695,16,"If you 're male , so is her ex . If you 're female , so is her ex . If you 're female and you choose the creepy `` Give me a kiss '' choice in her 2 heart event , she says `` Oh , you 're ... ? Me too , good to know , '' ( before smacking you and kicking you out ) .",29.0,2020-07-31 09:15:20,241.0,0.0,0.87,0.13,0.872
1696,17,"Haven ’ t downloaded yet , but this is the one I ’ m looking at :",9.0,2020-07-31 07:05:38,241.0,0.0,1.0,0.0,0.0
1697,18,"bi people can be attracted to non-binary people as well though , right ?",1.0,2020-08-16 08:15:56,241.0,0.0,0.823,0.177,0.4215
1698,19,`` Any single character '' . somewhere is hiding a Clint making Sad noises .,15.0,2020-07-31 05:22:00,241.0,0.29,0.71,0.0,-0.6486
1699,20,"I personally disagree with you because it 's not like everyone in a community would be attracted to you no matter what gender you are , which is the case in stardew . If you have 8 hearts with all single candidates , all of them will try to flirt with you . This indicates that everyone is bi-sexual , which would be weird to have so many bi-sexuals in a single community , do n't you think ? Also , I 'm pretty sure Leah 's heart event will change depending on the gender that the player created , being female if you are female and male if you are male , making her not really bi-sexual , but player sexual again . In the end , I believe strongly that it was mostly a decision to make the game easier to program to just make all single candidates romanceable regardless of gender . To me , making everyone player sexual dampens the depth of the romance . That being said , stardew really is n't a dating sim as much as it is an artistic form of escapism to being a farmer with a sense of exploration and strengthening your local community . The `` dating '' part of the game is pretty shallow unfortunately , limited to a handful of heart events per character and repetitive dialogue .",4.0,2020-07-31 05:22:19,241.0,0.052,0.802,0.146,0.9792
1700,21,"The opposite gender as the main character ? Concerned Ape could have made it that way to declare her Bi . But in these type of games EVERYONE tends to be bi . but Leah is one of the few cases where a character seems Gay or ( /and ) Straight . where as sebi , abi , and alex who do n't realize they 're bi until they meet you ( as same gender ) . where as the rest of the people do n't have any special text based on your gender so are therefore you 're typical bi video game bachelo",9.0,2020-07-31 12:55:12,241.0,0.027,0.951,0.022,-0.1373
1701,22,Thank you so much good person ! always made me sad that i was married to Sebi and I could n't even have Aby live on my farm in a spare house ) :,3.0,2020-07-31 07:26:08,241.0,0.077,0.774,0.149,0.4349
1702,23,"Yeh , bi means attracted to two genders , which can be any two",1.0,2020-08-16 08:43:21,241.0,0.0,0.823,0.177,0.4215
1703,24,"also , poor Sandy .",8.0,2020-07-31 05:22:54,241.0,0.437,0.563,0.0,-0.4767
1704,25,My bf married Emily in his save and I was legitimately sad for Clint .,3.0,2020-07-31 10:39:00,241.0,0.161,0.674,0.166,0.0258
1705,26,"I 've written about this before , reposting it here : -- - I think this is one of those cases where there 's an acceptable break from reality . It 's not realistic that you can date any of the marriage candidates regardless of the gender , but the game would n't be as appealing to a lot of people if it limited player choice like that . It 's very common that games allowing romances will limit themselves to 1 ( maybe 2 if you 're lucky ) gay option for each gender , which is realistic given the size of the cast and the frequency of gay people in real life , but it means that straight players get to choose who they want to date , while gay players do n't ( and oftentimes that character is bi anyway , so straight players can still choose the opposite sex 's gay option , while gay players only get the one option ) . In real life , there are certainly fewer gay people than straight people , but since there are so many people , the gay dating scene is n't , `` here 's the gay option , take it or leave it . '' In a cast the size of Stardew Valley , realism would dictate that there 's a high chance none of the marriage candidates would be gay . Because of the common game design choice to limit gay players to the designated gay option , if I know a game has romance options going in and allows players to choose their gender , I 've taken to looking up how the game handles same sex relationships , and if it 's just `` here 's your token gay option , take it or leave it , '' I usually end up playing as a female character just so I can still participate in that part of the game . By making all the characters effectively bi , gay male players get to make the same choices as straight female players , and straight male players get the same choices as gay female players , so both gay and straight players alike can enjoy the romance aspects of the game . For gay players , the way Stardew Valley handles the sexuality of the marriage candidates is a nice escape from the reality of real life dating : on top of the chance that the other person just is n't interested in you that straight people also have to deal with , there 's the added challenge that , because of the ratio of gay people to straight people , it is likely that most people you find attractive will turn out to be straight . If you 're straight , and you 've been attracted to a person you later learned was gay , the equivalent experience for a gay person is probably around at least 20 times more probable .",9.0,2020-07-31 10:44:31,241.0,0.014,0.844,0.142,0.9966
1706,27,Stardew isn ’ t a dating sim so I don ’ t think it really matters if it ’ s true to “ real life ” or not . You don ’ t date someone irl once you ’ ve given them 10 gifts and not everyone in a single town would be bisexual . I am fine with the characters being player sexual or bisexual or whatever because you ’ re supposed to be cultivating a community and being given that freedom as a player allows you to create the community that you want .,2.0,2020-07-31 10:38:29,241.0,0.0,0.869,0.131,0.8908
1707,28,i only give sdv a 9/10 because you can ’ t marry Sandy or Demetrius,1.0,2020-07-31 11:40:32,241.0,0.0,1.0,0.0,0.0
1708,0,Junimo Kart is what waits for all of us after a life of sin,7.0,2020-07-31 06:14:51,242.0,0.217,0.783,0.0,-0.5574
1709,1,We need both the arcade games in full form for free as separate games,3.0,2020-07-31 19:14:01,242.0,0.0,0.798,0.202,0.5106
1710,2,Ikr that would be amazing,2.0,2020-07-31 21:09:12,242.0,0.0,0.513,0.487,0.5859
1711,0,My gf married Shane and recently divorced him . If he ’ s not trying to better himself and even clean up a little then it ’ s time for him to go 😤,9.0,2020-07-31 02:50:07,243.0,0.059,0.876,0.066,0.0757
1712,1,Excuse me but Shane is my husband and im not sharing 😤😤😤,5.0,2020-07-31 05:25:27,243.0,0.107,0.853,0.041,-0.4306
1713,0,"Wha- yeah fuck it , battery acid , hell yeah",8.0,2020-07-30 19:33:47,244.0,0.438,0.324,0.238,-0.6908
1714,1,* ENERGY INCREASED *,3.0,2020-08-01 05:11:06,244.0,0.0,0.261,0.739,0.6874
1715,2,On one of my characters I put `` anime thighs '' and completely forgot .,2.0,2020-08-04 17:03:16,244.0,0.0,1.0,0.0,0.0
1716,0,This made my day and it 's incredibly true,89.0,2020-07-30 05:13:35,245.0,0.0,0.721,0.279,0.4754
1717,1,"I hate the festivals , everyone can go into town except for the farmer who has been there for 4 years and just wants to get something .",78.0,2020-07-30 06:21:04,245.0,0.115,0.807,0.078,-0.296
1718,2,Music stopped at my favorite moment > : (,29.0,2020-07-30 05:23:08,245.0,0.16,0.588,0.252,0.2732
1719,3,The heart event music is good too .,24.0,2020-07-30 06:42:34,245.0,0.0,0.458,0.542,0.7964
1720,4,spirit 's eve event is still my fave even tho i can do it in 30 seconds . love the spooky music,14.0,2020-07-30 11:57:26,245.0,0.0,0.683,0.317,0.8316
1721,5,"I 'm the opposite , hahaha . I 'm over the festivals after year 1",2.0,2020-07-30 14:41:26,245.0,0.0,0.681,0.319,0.7269
1722,6,It ’ s my favorite song on the playlist !,2.0,2020-07-30 16:20:39,245.0,0.0,0.732,0.268,0.5093
1724,8,This may as well be one of the best memes I have ever seen .,1.0,2020-08-01 05:55:47,245.0,0.0,0.769,0.231,0.6369
1725,9,Jeez this is so precious,1.0,2020-08-01 07:07:53,245.0,0.0,0.458,0.542,0.6948
1727,11,"I 've decided to stop going to the grange display festival because it takes the longest to prepare for and your reward for winning is 1,000 tickets to the booth you 've probably cleared out already . I do n't need any more potted plants , thank you very much",34.0,2020-07-30 07:44:17,245.0,0.036,0.728,0.235,0.9001
1728,12,A stillness in the rain is one of my favorites .,11.0,2020-07-30 09:40:14,245.0,0.0,0.781,0.219,0.4215
1729,13,"The best is if you get the seasonal outfits mod , all the NPCs have perfect costumes .",14.0,2020-07-30 15:25:13,245.0,0.0,0.669,0.331,0.836
1730,14,"* beep . boop . * 🤖 I 'm a bot that helps downloading videos # # # [ Download via reddit.tube ] If I do n't reply to a comment , send me the link [ per message . ] [ Download more videos from StardewMemes ] * * * [ Info ]",1.0,2020-08-21 11:01:22,245.0,0.0,0.954,0.046,0.3818
1731,15,I ’ m in my 3rd year and first play through and I think I ’ m going to skip the fair this year tbh,12.0,2020-07-30 08:01:43,245.0,0.0,0.83,0.17,0.5719
1732,16,I 've taken up going to every festival after I 've done my chores for the day talk to everyone ever since ape changed how taking to them at festivals works for friendship,2.0,2020-08-04 18:59:03,245.0,0.0,0.777,0.223,0.8225
1733,17,yes ! ! i love elliott as a vampire the most,7.0,2020-07-30 16:47:02,245.0,0.0,0.546,0.454,0.8168
1734,18,Yes ! Astronaut Maru is best Maru,1.0,2020-08-08 11:20:23,245.0,0.0,0.41,0.59,0.8016
1735,19,"Same goes for the egg hunt . 1,000 coins for beating a bunch of children ? I can make 80 times that just makin cheese all day",21.0,2020-07-30 10:55:00,245.0,0.103,0.897,0.0,-0.4588
1736,0,KAKYOIN ! !,2.0,2020-08-01 21:08:48,246.0,0.0,1.0,0.0,0.0
1737,0,I 'd do anything to make Sebastian happy,13.0,2020-07-30 14:53:03,247.0,0.0,0.654,0.346,0.5719
1738,1,These will never stop cracking me up .,4.0,2020-08-02 04:05:23,247.0,0.0,0.788,0.212,0.2235
1739,2,so Maru is n't the only one who got the strange Quests : D,3.0,2020-08-06 18:50:59,247.0,0.0,1.0,0.0,0.0
1740,3,same tho,4.0,2020-07-31 05:32:00,247.0,0.0,1.0,0.0,0.0
1741,0,I 'm sorry villager . I did n't mean to hurt you . I 'll sacrifice my progress for your happiness . You 'll never know .. but I will .,45.0,2020-07-30 00:30:02,248.0,0.034,0.789,0.178,0.6044
1742,1,Me when i read the mean dialogue options in heart events : ( it honestly breaks my heart when I read some of them .,14.0,2020-07-30 04:21:59,248.0,0.0,0.659,0.341,0.9081
1743,2,"The one where Demetrius wants you to say that tomatoes are fruits is especially frustrating . I mean , bitch , they 're under the vegetables category in the menu",7.0,2020-07-30 07:46:51,248.0,0.2,0.8,0.0,-0.7902
1744,3,"Nothing will ever hurt more than when in my first play through , at Linus ’ s 10-heart event I asked him to move onto my farm , because he was my first friend , and he said no . My heart shattered and not a day goes by without thinking of what could have been .",7.0,2020-08-08 11:23:07,248.0,0.077,0.74,0.183,0.8061
1745,4,"me , playing on mobile knowing that wo n't save me :",2.0,2020-07-30 15:03:05,248.0,0.182,0.693,0.125,-0.2091
1746,5,I was accidentally mean to Linus once T_T,2.0,2020-08-11 10:39:57,248.0,0.255,0.745,0.0,-0.34
1747,6,yeah ... I would rather delete the game than choose a mean dialogue option honestly,6.0,2020-07-30 14:33:29,248.0,0.0,0.714,0.286,0.6369
1748,0,I ’ ve been meaning to play some other games but I need two things then I complete the community center .,2.0,2020-08-14 09:10:44,249.0,0.0,0.925,0.075,0.1779
1749,0,I just wa n't my pants to match my overalls . Is that too much ?,13.0,2020-07-29 13:58:23,250.0,0.0,1.0,0.0,0.0
1750,1,"Use the big skirt/dress bottom ( that ’ s option 5 I think .. ) it ’ s a bigger area to match up and easier to see , then switch to whatever bottoms you want for a better color match : )",2.0,2020-07-29 15:56:26,250.0,0.0,0.851,0.149,0.7184
1751,2,"There 's this nice purple shirt . Wanted my dress to match . It 's only slightly brighter , but at night/when it rains it amplifies the color and I get to see my mistakes all over again .",5.0,2020-07-29 14:10:18,250.0,0.076,0.837,0.088,-0.1208
1752,3,"I did use the big skirt actually , I still got the colors wrong 😅 .",5.0,2020-07-29 16:00:00,250.0,0.137,0.752,0.111,-0.1531
1753,4,"Damn I ’ m sorry then : ( ( I ’ ve started and restarted my game too many times cause I didn ’ t like the outfit in the beginning lol You might be able to get the same color dyeing your skirt/pants , sea urchins give a good purple and plain cloth lightens",2.0,2020-07-29 16:01:50,250.0,0.064,0.804,0.132,0.6369
1754,0,What a classic meme . You are an absolute deity .,39.0,2020-07-29 05:05:54,251.0,0.0,1.0,0.0,0.0
1755,1,oof,8.0,2020-07-29 03:20:24,251.0,0.0,1.0,0.0,0.0
1756,2,"As someone that loves the “ leaked ” game , ouch my heart . I haven ’ t recovered yet .",6.0,2020-07-29 13:46:59,251.0,0.082,0.638,0.28,0.765
1757,3,Lollllol,6.0,2020-07-29 07:47:45,251.0,0.0,1.0,0.0,0.0
1758,4,I don ’ t know why it took me so long to understand this,2.0,2020-07-29 14:43:47,251.0,0.0,1.0,0.0,0.0
1759,5,We know .,2.0,2020-07-29 16:52:45,251.0,0.0,1.0,0.0,0.0
1760,6,WHY AM I FUCKING LAUGHING WHAT THE -- -- -- -,2.0,2020-07-29 20:42:09,251.0,0.0,0.668,0.332,0.7148
1761,7,( I still don ’ t get it ..... can you explain ? ),3.0,2020-07-29 15:51:50,251.0,0.0,1.0,0.0,0.0
1762,8,The 2 vegtables in the bottom panel are leeks .,3.0,2020-07-29 16:03:47,251.0,0.0,1.0,0.0,0.0
1763,9,You leaked it !,2.0,2020-08-06 07:35:19,251.0,0.464,0.536,0.0,-0.3802
1764,0,Godzilla had a stroke reading this and fucking died,32.0,2020-07-28 22:44:11,252.0,0.327,0.673,0.0,-0.5984
1765,1,for me junimo kart is harder than prairie king,26.0,2020-07-29 03:48:22,252.0,0.0,1.0,0.0,0.0
1766,2,Your crush is Abigail : (,5.0,2020-07-29 03:42:20,252.0,0.242,0.758,0.0,-0.1531
1767,3,praire what ?,1.0,2020-07-29 05:42:42,252.0,0.0,1.0,0.0,0.0
1768,4,I ’ m convinced that God made ConcernedApe put JunimoKart in the game to prevent the game from becoming too powerful,18.0,2020-07-29 05:00:03,252.0,0.0,0.661,0.339,0.7717
1769,5,But new jumino kart is fun,3.0,2020-07-29 06:07:16,252.0,0.0,0.529,0.471,0.6652
1770,6,The left hand arcade game in the bar,3.0,2020-07-29 11:04:18,252.0,0.0,0.686,0.314,0.4939
1771,0,You still have 78 un-stardew filled hours a week my friend .,3.0,2020-07-29 14:33:16,253.0,0.0,0.775,0.225,0.4939
1772,0,Spicy eel * * and * * pepper popper ? One just overwrites the other .,5.0,2020-07-29 06:10:23,254.0,0.0,1.0,0.0,0.0
1773,0,* Your ears are filled with `` S-SENPAIIII ! T-THAT 'S ENOUGH . ANYMORE A-AND I'LL- KYAAAAAAAAA * \~ ``,4.0,2020-07-29 15:14:47,255.0,0.0,1.0,0.0,0.0
1774,1,you got some numbas for me,2.0,2020-07-29 05:05:48,255.0,0.0,1.0,0.0,0.0
1775,0,He definitely has an odd taste in gifts lol . I always just give him salmonberries and he ’ s fine with it .,108.0,2020-07-28 10:51:17,256.0,0.078,0.676,0.247,0.6124
1776,1,Simple . He 's a biology/chemistry nerd not an archeology nerd .,44.0,2020-07-28 11:30:28,256.0,0.156,0.71,0.134,-0.0803
1777,2,Maybe he 's Wario,8.0,2020-07-28 13:59:46,256.0,0.0,1.0,0.0,0.0
1778,3,I just give him the common mushrooms I get from whatever that thing is that he built in that hole and he seems to love them every time .,39.0,2020-07-28 11:48:29,256.0,0.0,0.87,0.13,0.6369
1779,4,"Well we know that you can hatch real dinosaurs from the dinosaur eggs , so you 'd think he would be interested in studying a real living dinosaur egg .",31.0,2020-07-28 12:33:26,256.0,0.0,0.915,0.085,0.4019
1780,5,"Ok I ’ ll try one of those . It ’ s funny because he lives next to an actual mine , but instead went across town to a tiny cave on someone ’ s farm .",27.0,2020-07-28 11:57:54,256.0,0.0,0.908,0.092,0.3716
1781,6,"He just has a problem with vampires , he ’ s trying to make better garlic weapons",19.0,2020-07-28 14:27:54,256.0,0.249,0.622,0.129,-0.4019
1782,7,but the mine has monsters in it so it woud n't be safe for him,11.0,2020-07-28 17:15:19,256.0,0.182,0.818,0.0,-0.4782
1783,8,Lol yeah that bugged me for a while too when I first started Edit for word,9.0,2020-07-28 12:03:26,256.0,0.0,0.737,0.263,0.6124
1784,9,Got ta protect himself from Seb,21.0,2020-07-28 17:54:12,256.0,0.0,0.658,0.342,0.3818
1785,10,this comment is peak comedy,5.0,2020-08-01 11:16:43,256.0,0.0,0.615,0.385,0.3612
1786,0,But Shane and i 's love is god .,2.0,2020-08-04 17:59:47,257.0,0.0,0.453,0.547,0.8573
1787,0,"Please try to keep all the text when cropping next time , thanks",1.0,2020-07-28 12:03:05,259.0,0.0,0.679,0.321,0.6369
1788,1,"Shoot , I ’ m on mobile , didn ’ t realize the crop was different , my apologies !",1.0,2020-07-28 12:04:07,259.0,0.124,0.876,0.0,-0.4003
1789,2,"Hmm I 'm on mobile too , maybe it 's cuz of the slideshow thing ?",1.0,2020-07-28 12:04:50,259.0,0.0,1.0,0.0,0.0
1790,0,"Damn . That ’ s the hardest fish to catch in the game , imo . It took me a whole year of playing to get it .",41.0,2020-07-28 05:43:15,260.0,0.089,0.852,0.059,-0.2263
1791,1,That 's one of the few ones I have left to catch . I need it for a fish pond but I have up trying and it 's now fall . I 'm hoping the traveling cart will have one eventually . That 's a bs request for sure .,17.0,2020-07-28 04:56:24,260.0,0.0,0.878,0.122,0.7684
1792,2,I think your post and this post go together :,1.0,2020-07-28 17:01:51,260.0,0.0,1.0,0.0,0.0
1793,3,"I found the Glacierfish to be the hardest . The octopus is certainly up with the harder legendaries , but Glacierfish took me longer for sure .",12.0,2020-07-28 07:15:26,260.0,0.0,0.843,0.157,0.5647
1794,4,"Really , though ? I usually get mine on the first try",0.0,2020-07-28 15:04:34,260.0,0.0,1.0,0.0,0.0
1795,5,I got one from digging in the trash . Pure talent .,9.0,2020-07-28 07:53:23,260.0,0.0,0.797,0.203,0.4215
1796,6,I did have trouble with the Glacierfish . But the octopus is still the worst ! !,2.0,2020-07-28 09:50:57,260.0,0.35,0.65,0.0,-0.8436
1797,7,Digging one out of the trash doesn ’ t count towards the catch all the fish achievement,5.0,2020-07-28 09:15:09,260.0,0.0,1.0,0.0,0.0
1798,8,I also gave up on the glacierfish lol,2.0,2020-07-28 10:13:05,260.0,0.0,0.714,0.286,0.4215
1799,0,Literally though,1.0,2020-07-28 10:46:40,261.0,0.0,1.0,0.0,0.0
1800,0,\ * SIGHS IN PUN\ *,3.0,2020-07-28 08:20:51,262.0,0.0,1.0,0.0,0.0
1801,1,LOL,2.0,2020-07-28 08:25:18,262.0,0.0,0.0,1.0,0.4215
1802,0,I tend to get rain in the early game the day after I place a bunch of spinklers,44.0,2020-07-27 13:47:17,263.0,0.0,1.0,0.0,0.0
1803,1,"Grinding in game to upgrade and get a BUNCH of iridium sprinklers is definitely worth ! Also the Junimo helpers , they help harvest all your crops ( except when it rains ) and are incredibly cute 🥺 My friend and I grew our farm to ~1000 plots and I only need to water when it ’ s the first of the season and harvest from the greenhouse . It definitely cuts down the tedious work",32.0,2020-07-27 19:34:06,263.0,0.024,0.766,0.21,0.9401
1804,2,Yes,3.0,2020-07-28 00:10:13,263.0,0.0,0.0,1.0,0.4019
1805,3,"800 crops ? Those are rookie numbers , you got ta get those numbers up",1.0,2020-07-28 05:42:17,263.0,0.0,1.0,0.0,0.0
1806,4,"if you let your crops die at the end/beginning of a season , the sprinklers will still water the plots , so you just have to clear and resead",11.0,2020-07-28 01:10:47,263.0,0.116,0.806,0.078,-0.3182
1807,5,"For the summer to fall transition , plant wheat . It can grow during both , is cheap , and is only a 4 day crop so it does n't tie up the plots for long . Not a lot of profit from it , but better than nothing . It also givews you a bit of an easier start to fall since you are n't rushing to plant your entire field on the first day .",13.0,2020-07-28 02:30:44,263.0,0.0,0.886,0.114,0.8591
