,Unnamed: 0,Reply,Upvote,Time,Key,neg,neu,pos,compound
0,0,"If Haley 's homophobic , she wo n't agree to marry female player character . Checkmate",91.0,2020-09-17 11:24:21,0.0,0.123,0.877,0.0,-0.2755
1,1,Does she actually have homophobic dialogue ? I have really interacted with her all that much in my playthroughs .,21.0,2020-09-17 12:23:50,0.0,0.0,1.0,0.0,0.0
2,2,"For everyone who might be having this whoosh over their heads Haley is the only NPC in the game who doesnt like to be gifted Prismatic Shards , which are rainbow colored . She is not homophobic lol all the marriage candidates are bi at the very least , because you can marry them regardless if what gender you play as .",1.0,2020-09-17 18:45:33,0.0,0.067,0.896,0.036,-0.2598
3,3,cancel haley😡😡,11.0,2020-09-17 12:50:59,0.0,0.286,0.714,0.0,-0.25
4,4,Wait really ? ? What does she say ?,2.0,2020-09-17 16:50:13,0.0,0.0,1.0,0.0,0.0
5,5,Yeah that actually made me laugh out loud,33.0,2020-09-17 11:57:01,0.0,0.0,0.508,0.492,0.7003
6,6,"i think she ’ ll just saying something if you date alex , i think george also says something along the lines of ‘ back in my dad a man loving a man was wrong , but if my grandson wants to he can ’ or something",40.0,2020-09-17 12:34:03,0.0,0.041,0.909,0.049,0.1027
7,7,Date haley,34.0,2020-09-17 12:54:15,0.0,0.0,1.0,0.0,0.0
8,8,Twas but a joke,1.0,2020-09-17 17:43:41,0.0,0.0,0.517,0.483,0.4215
9,9,Back in his dad ? 😳,24.0,2020-09-17 14:59:17,0.0,0.0,1.0,0.0,0.0
10,10,oh my god it was sarcasm y ’ all i love haley-,14.0,2020-09-17 13:15:49,0.0,0.11,0.523,0.366,0.6597
11,11,Ah ok good . Never befriended her but thought about romancing her with a female farmer bc it could be cute,1.0,2020-09-17 18:03:54,0.0,0.0,0.595,0.405,0.8898
12,12,I am going to date Haley,12.0,2020-09-17 13:40:58,0.0,0.0,1.0,0.0,0.0
13,0,i thought this was minecraft for a second and was very confused,41.0,2020-09-17 06:11:28,1.0,0.191,0.809,0.0,-0.3804
14,1,I love this,8.0,2020-09-17 02:25:37,1.0,0.0,0.323,0.677,0.6369
15,2,Me when I walk into my keg shed,5.0,2020-09-17 08:44:52,1.0,0.0,1.0,0.0,0.0
16,3,Lol I thought the same thing .,11.0,2020-09-17 06:19:20,1.0,0.0,0.682,0.318,0.4215
17,4,lmao,4.0,2020-09-17 06:41:25,1.0,0.0,0.0,1.0,0.5994
18,5,Thanks a lot,3.0,2020-09-17 03:35:16,1.0,0.0,0.408,0.592,0.4404
19,6,hahah,1.0,2020-09-17 20:16:03,1.0,0.0,1.0,0.0,0.0
20,0,I give him pomegranates mostly in the spring because that 's when he says he craves them ! He gets a lot of coffee and duck feathers though .,92.0,2020-09-16 11:46:49,2.0,0.0,1.0,0.0,0.0
21,1,"Sebastian and frozen tears . I wake up , take it out of my crystalarium , and shove it right in his face . Continue to love me , husband .",88.0,2020-09-16 12:28:23,2.0,0.054,0.826,0.12,0.5106
22,2,Me giving Harvey wine before work every day because it ’ s funnier than coffee,44.0,2020-09-16 14:03:10,2.0,0.0,0.718,0.282,0.6249
23,3,Me with Alex and the complete breakfast,23.0,2020-09-16 12:06:48,2.0,0.0,1.0,0.0,0.0
24,4,Same thing with Penny and diamonds .,17.0,2020-09-16 10:53:19,2.0,0.0,1.0,0.0,0.0
25,5,Me giving Sebastian every Quartz I could find,10.0,2020-09-16 12:40:03,2.0,0.0,0.745,0.255,0.34
26,6,I grow cactus fruit in the cave to make sure Sam has an endless supply .,5.0,2020-09-16 21:02:41,2.0,0.0,0.867,0.133,0.3182
27,7,Shane and his morning beer . I don ’ t care that you got sober for me . Drink it honey .,2.0,2020-09-17 06:40:45,2.0,0.0,0.868,0.132,0.4939
28,8,This is what I did . [,1.0,2020-09-16 19:50:51,2.0,0.0,1.0,0.0,0.0
29,9,Every day I give Krobus gold or iridium quality void eggs,1.0,2020-09-17 06:29:19,2.0,0.0,1.0,0.0,0.0
30,10,"God fr lmfao , I wake up , go to the pomegranate tree and get one , and then give it to Elliott . I got ta switch over to lobsters when the fall ends , though .",21.0,2020-09-16 12:34:37,2.0,0.0,0.865,0.135,0.6808
31,11,"He has fresh iridium quality sashimi for breakfast every day with me , better be grateful .",2.0,2020-09-16 16:33:54,2.0,0.0,0.631,0.369,0.802
32,12,So relatable . It 's so easy to make when you finally have enough ingredients to last for seasons . But when it 's fall I make sure to catch some salmon so that I can make him some salmon dinner .,10.0,2020-09-16 13:40:06,2.0,0.0,0.883,0.117,0.6509
33,13,Gold star poppies are fun . Lot easier to come by as well . I ’ ve got a chest of them .,5.0,2020-09-16 14:43:41,2.0,0.0,0.775,0.225,0.7269
34,14,Wait you can grow cactus fruit in the cave ...,2.0,2020-09-17 03:00:19,2.0,0.0,1.0,0.0,0.0
35,15,Plant a pomegranate tree in your greenhouse and you will have them year round !,20.0,2020-09-16 13:54:52,2.0,0.0,1.0,0.0,0.0
36,16,How can you get an iridium quality dish ... ?,1.0,2020-09-17 04:07:27,2.0,0.0,1.0,0.0,0.0
37,17,Me too !,3.0,2020-09-16 17:31:09,2.0,0.0,1.0,0.0,0.0
38,18,"Yeah ! If you have access to the garden pot recipe you can fit approximately 12 of those pots in there and then plant cactus fruit in them . Apparently , the cave counts as indoors !",3.0,2020-09-17 03:42:34,2.0,0.0,0.869,0.131,0.6467
39,19,"Ah thanks ! I just planted one not too long ago recently as I 've only just unlocked the greenhouse , once it grows Elliott better get ready for even more daily pomegranates",17.0,2020-09-16 14:08:26,2.0,0.0,0.777,0.223,0.8221
40,20,"I do n't think it 's possible , I just fish so much that the fishes are always iridium . : D",1.0,2020-09-17 07:05:06,2.0,0.0,1.0,0.0,0.0
41,21,Wow thanku for this !,2.0,2020-09-17 04:25:01,2.0,0.0,0.494,0.506,0.6239
42,22,"I don ’ t know if it ’ s been changed since 1.4 , but at least when I was playing regularly , you planted trees around the edges of the inside of the greenhouse . It ’ s not necessary to use up the valuable soil in the middle to get your trees .",3.0,2020-09-17 04:32:42,2.0,0.0,0.893,0.107,0.7469
43,0,Creamy,2.0,2020-09-17 12:27:22,3.0,0.0,1.0,0.0,0.0
44,0,And then theres the fortune teller from the Stardew Valley Fair : (,10.0,2020-09-16 08:53:14,4.0,0.0,0.839,0.161,0.3182
45,1,Okay but the weather is sometimes wrong,-1.0,2020-09-16 08:52:08,4.0,0.392,0.472,0.137,-0.5719
46,2,Same lady I think,10.0,2020-09-16 08:59:06,4.0,0.0,1.0,0.0,0.0
47,3,They are the same person,1.0,2020-09-16 19:00:29,4.0,0.0,1.0,0.0,0.0
48,4,No it 's not ?,13.0,2020-09-16 08:54:04,4.0,0.355,0.645,0.0,-0.296
49,5,I 've never seen the weather being wrong,6.0,2020-09-16 09:21:55,4.0,0.307,0.693,0.0,-0.4767
50,6,I have multiple different times like it will say that today will be a sunny day but it is poring rain,1.0,2020-09-16 11:16:14,4.0,0.0,0.839,0.161,0.3919
51,7,They tell you tomorrows weather not today,7.0,2020-09-16 11:21:19,4.0,0.0,1.0,0.0,0.0
52,8,Am I just dumb is it always tomorrows weather,6.0,2020-09-16 11:22:31,4.0,0.292,0.708,0.0,-0.5106
53,9,RIP,4.0,2020-09-16 11:29:50,4.0,0.0,1.0,0.0,0.0
54,10,"It is always tomorrow 's weather . If you just quickly click past the first screen and only read the second screen , it can be confusing . Because sometimes the second screen mentiones the word `` tomorrow '' and sometimes not . On the first screen it always says that the weather forecast is for tomorrow .",3.0,2020-09-16 12:23:17,4.0,0.032,0.968,0.0,-0.2263
55,11,Thanks I honestly had no idea,2.0,2020-09-16 15:24:03,4.0,0.198,0.27,0.532,0.5719
56,0,"I always marry Alex , which is funny because I hated him when we first met , and now I love him .",20.0,2020-09-15 22:51:21,5.0,0.134,0.639,0.227,0.4404
57,1,Wrong sub ?,31.0,2020-09-15 20:20:38,5.0,0.608,0.392,0.0,-0.4767
58,2,when you marry Sam every time you restart 😔,2.0,2020-09-16 01:21:11,5.0,0.0,0.874,0.126,0.0772
59,3,lol,1.0,2020-09-16 05:28:34,5.0,0.0,0.0,1.0,0.4215
60,4,One playthrough i married maru over and over again just so i could keep divorcing her ( as she 's the worst lady ) it was pretty psychotically dissociating .,-65.0,2020-09-15 19:59:37,5.0,0.116,0.793,0.091,-0.2263
61,5,Haley fans agree,5.0,2020-09-16 03:45:00,5.0,0.0,0.444,0.556,0.3612
62,6,it 's referring to something in the end-game : ),35.0,2020-09-15 21:10:31,5.0,0.0,1.0,0.0,0.0
63,7,No it ’ s ... referencing something in game,11.0,2020-09-15 23:39:13,5.0,0.216,0.784,0.0,-0.296
64,8,It might be referring to starting a new playthrough and romancing the same person ?,15.0,2020-09-15 20:46:35,5.0,0.0,0.824,0.176,0.4588
65,9,Ummmm ...,28.0,2020-09-15 20:24:39,5.0,0.0,1.0,0.0,0.0
66,10,"WTF , she ’ s the best !",25.0,2020-09-15 21:40:43,5.0,0.321,0.399,0.28,-0.1593
67,11,* grabs pitchfork *,22.0,2020-09-15 22:08:45,5.0,0.0,1.0,0.0,0.0
68,12,heyyyy : ( (,14.0,2020-09-15 21:10:01,5.0,0.0,1.0,0.0,0.0
69,13,"`` They hated Jesus , for he told them the truth . '' But seriously , did none of you nay-sayers ever meet abigail , leah , or emily ? Those three make Maru look like a foot .",0.0,2020-09-16 16:19:12,5.0,0.104,0.786,0.11,0.0644
70,14,"She definitely is n't the worst , but the best but not the worst . I wan na do this to sebastian cause he IS the worst",-2.0,2020-09-16 08:22:12,5.0,0.135,0.525,0.34,0.8219
71,15,wait what is it referring to ? can you dm me if its a pretty srs spoiler ?,9.0,2020-09-15 23:55:08,5.0,0.0,0.827,0.173,0.5514
72,16,"No , it 's referencing an end-game mechanic .. spoiler : > ! After divorcing your ingame spouse you can wipe their memory ( otherwise they hate you after the divorce ) and romance them again ! <",21.0,2020-09-16 01:22:22,5.0,0.144,0.776,0.08,-0.4374
73,17,"`` What are you gon na do , stab me ? '' `` Quote from man stabbed ''",-3.0,2020-09-16 00:37:53,5.0,0.295,0.705,0.0,-0.7717
74,18,[ deleted ],0.0,2020-09-16 01:29:48,5.0,0.0,1.0,0.0,0.0
75,19,"yeah kinda , the reward is actually a statue that can do that . it 's one of 3 statues in the witch 's hut",3.0,2020-09-16 01:41:38,5.0,0.083,0.73,0.187,0.483
76,0,I 'll understand if it was like an eggplant or a super cucumber . I just ca n't see why in Stardew Valley would Haley want to use a Flounder .,101.0,2020-09-15 02:15:25,6.0,0.0,0.884,0.116,0.4215
77,1,SHE 'S MAKING FISH TACOS ! JEBUS PEOPLE,76.0,2020-09-15 02:20:55,6.0,0.0,1.0,0.0,0.0
78,2,I thought something seemed fishy !,22.0,2020-09-15 05:05:17,6.0,0.0,1.0,0.0,0.0
79,3,I need answers,42.0,2020-09-14 21:09:07,6.0,0.0,1.0,0.0,0.0
80,4,"shhhhh , its a secret",12.0,2020-09-15 06:47:02,6.0,0.0,1.0,0.0,0.0
81,5,> Haley will be pleased 😏😳,22.0,2020-09-15 05:46:09,6.0,0.0,0.734,0.266,0.4404
82,6,ah the flounder ..... nature 's maxi pad,18.0,2020-09-15 07:35:20,6.0,0.0,1.0,0.0,0.0
83,7,on my wifes game she wanted an eggplant,6.0,2020-09-15 14:06:11,6.0,0.0,1.0,0.0,0.0
84,8,Oh no,8.0,2020-09-14 21:49:47,6.0,0.688,0.312,0.0,-0.296
85,9,Does this only show if you are a girl character ?,8.0,2020-09-15 05:31:05,6.0,0.0,1.0,0.0,0.0
86,10,stuffinh it in,2.0,2020-09-15 05:30:31,6.0,0.0,1.0,0.0,0.0
87,11,"`` Little mermaid '' , Origins !",1.0,2020-09-15 12:52:55,6.0,0.0,1.0,0.0,0.0
88,12,I bet she 'll be pleased 😂,1.0,2020-09-15 06:00:01,6.0,0.114,0.482,0.404,0.7003
89,13,They might want to compare smells .,-5.0,2020-09-15 08:27:00,6.0,0.0,0.822,0.178,0.0772
90,14,Might not be something sexual !,37.0,2020-09-15 04:41:47,6.0,0.0,1.0,0.0,0.0
91,15,Don ’ t kink shame . /s,9.0,2020-09-15 07:23:21,6.0,0.341,0.659,0.0,-0.4767
92,16,You do n't know that lol,5.0,2020-09-15 06:57:22,6.0,0.318,0.682,0.0,-0.3252
93,17,"You know what its for , do n't lie .",42.0,2020-09-15 02:33:34,6.0,0.0,1.0,0.0,0.0
94,18,They 're onto us ...,3.0,2020-09-15 07:12:13,6.0,0.0,1.0,0.0,0.0
95,19,I ’ m pretty sure . I sunk a lot of hours into my male farmer and never saw it until playing as a female farmer . It was only like two weeks into the game too It ’ s really interesting how the dialogue changes from switching farmer ’ s gender . Not like .... drastically .... but more than I expected . Like damn Alex is flirty o///o,27.0,2020-09-15 05:50:08,6.0,0.064,0.761,0.175,0.7133
96,20,True but what else would she use it for ? She never really cooks .,5.0,2020-09-15 12:52:03,6.0,0.0,0.881,0.119,0.2263
97,21,"It 's Haley , it 's either sexual or dumb",27.0,2020-09-15 07:58:55,6.0,0.268,0.732,0.0,-0.5106
98,22,Yes I do,8.0,2020-09-15 07:16:25,6.0,0.0,0.426,0.574,0.4019
99,23,\ > >,17.0,2020-09-15 03:29:15,6.0,0.0,1.0,0.0,0.0
100,24,Pppsshh Alex is flirty regardless,7.0,2020-09-15 12:53:17,6.0,0.0,0.714,0.286,0.1531
101,25,oh,8.0,2020-09-15 05:51:47,6.0,0.0,1.0,0.0,0.0
102,26,Ugh yes Alex asks me if I have a bikini all the time .,3.0,2020-09-15 14:49:45,6.0,0.16,0.686,0.154,-0.0258
103,27,"Tbh from the “ FOR GIRLS ONLY ” , I was thinking maybe it ’ s a handy cure for PMS-related symptoms ¯\\\_ ( ツ ) _/¯ maybe flounder is the cure to cramps doctors won ’ t tell us about !",7.0,2020-09-15 16:56:54,6.0,0.0,0.911,0.089,0.6114
104,28,< <,8.0,2020-09-15 09:30:21,6.0,0.0,1.0,0.0,0.0
105,29,^ooh,4.0,2020-09-15 12:36:37,6.0,0.0,1.0,0.0,0.0
106,30,lol,2.0,2020-09-16 03:30:50,6.0,0.0,0.0,1.0,0.4215
107,31,"Dude , he 's also pretty gay for the male farmer . I do n't know why but on every save I have I 'm married to Alex .",1.0,2020-09-17 14:19:09,6.0,0.0,0.808,0.192,0.7506
108,32,"You dropped this \ * * * ^^ & # 32 ; To & # 32 ; prevent & # 32 ; anymore & # 32 ; lost & # 32 ; limbs & # 32 ; throughout & # 32 ; Reddit , & # 32 ; correctly & # 32 ; escape & # 32 ; the & # 32 ; arms & # 32 ; and & # 32 ; shoulders & # 32 ; by & # 32 ; typing & # 32 ; the & # 32 ; shrug & # 32 ; as & # 32 ; ` ¯\\\_ ( ツ ) _/¯ ` & # 32 ; or & # 32 ; ` ¯\\\_ ( ツ ) \_/¯ ` [ ^^Click & # 32 ; here & # 32 ; to & # 32 ; see & # 32 ; why & # 32 ; this & # 32 ; is & # 32 ; necessary ]",1.0,2020-09-15 16:57:10,6.0,0.014,0.969,0.017,-0.128
109,0,"Also : I did n't even manage to catch a flounder . I caught a bunch of sardines and herring ... The next day , I saw an ad for herring and thought it said Sebastian and was so angry ... After I gave him the herring I realized it had said Shane instead 😭 a whole mess lol",56.0,2020-09-14 08:51:58,7.0,0.141,0.818,0.04,-0.793
110,1,He still says that to my farmer and they ’ re dating -_____-,81.0,2020-09-14 08:40:06,7.0,0.0,1.0,0.0,0.0
111,2,He said that to me once after I proposed to him on that very spot * single tear *,3.0,2020-09-15 03:54:01,7.0,0.0,1.0,0.0,0.0
112,3,This burn was real .,1.0,2020-09-14 22:42:53,7.0,0.0,1.0,0.0,0.0
113,4,And I was tryjng to get Haley for flower dance year 1 ( I did manage to get her ) and she requested a sardine . I did get one after a while . And I caught a lot of flounders .,13.0,2020-09-14 10:25:12,7.0,0.0,1.0,0.0,0.0
114,5,Something similar just happened to me ! On my `` hearts & bones farmer '' save I saw a wanted poster from Haley that was like `` GIRLS ONLY : I need flounder . You know why ... keep it a secret '' or something like that . I usually play my OC farmer who 's a dude so I have n't seen female specific dialogue yet . So first I was like WHAT . Second I was like .............. well now I have some questions for Sebastian ..... And third when I finally got the flounder and gave it to her I did n't realize I was a day late . So she was like `` eww gross '' and I 'm sitting there like `` that 's what I said ! ? ! '' ..... I need to post that help wanted poster bc it was pretty hilarious [ edit here it is ] ^ ( It was early in the morning I restarted the day and gave the flounder to Sebastian no regrets ),1.0,2020-09-14 21:02:47,7.0,0.015,0.804,0.181,0.9844
115,6,"`` Babe , you 're great but sometimes I just need to be alone to stare out to sea in the rain ''",56.0,2020-09-14 08:48:25,7.0,0.096,0.806,0.098,0.0129
116,0,............. im glad that this is either modded or multiplayer both of which i cant do lol,1.0,2020-09-17 01:28:22,9.0,0.115,0.738,0.148,0.17
117,0,For me the go-to is lucky eel and enough coffee to drop a horse,49.0,2020-09-13 09:09:15,10.0,0.139,0.861,0.0,-0.2732
118,1,Yeah same but instead of pizza Im always with my full stack of gold star quality * * CHEESE * *,83.0,2020-09-13 08:43:19,10.0,0.0,0.926,0.074,0.1531
119,2,This is so funny because it 's so randomly specific lol,27.0,2020-09-13 09:02:53,10.0,0.0,0.569,0.431,0.7786
120,3,Mummies aren ’ t that bad if you use a slingshot with the exploding ammo . I always have a hard time with the dinosaurs .,12.0,2020-09-13 09:55:04,10.0,0.17,0.83,0.0,-0.5994
121,4,I use salads instead of pizzas and at that point in the game I permanently have lucky eel and espresso buffs applied because I got ta go * fast *,11.0,2020-09-13 10:12:26,10.0,0.0,1.0,0.0,0.0
122,5,Linus must be swole af,8.0,2020-09-13 10:27:44,10.0,0.0,1.0,0.0,0.0
123,6,I just run away from the mummies for the most part . They 're slow and stupid enough that they 're easy to avoid while looking for holes .,7.0,2020-09-13 10:28:38,10.0,0.162,0.754,0.084,-0.4019
124,7,I always just save a ton of salmonberries and eat those,5.0,2020-09-13 10:40:40,10.0,0.0,0.758,0.242,0.4939
125,8,"I 'm usually packing 300+ blueberries , ~20 Sashimi , ~40 Field Snacks , 20-30 Spicy Eel , 2-4 Life Elixers , and 20-25 Pumpkin Soups when I head down there . But the Galaxy Sword , Warp Totem : Desert , Slime Ring , and Return Scepter are the real MVP 's . I made it to Level 100 and nothing happened , I ended up restarting the day , hopefully with the update I can get that special event to trigger .",5.0,2020-09-13 15:43:46,10.0,0.0,0.92,0.08,0.7964
126,9,Wow . This is startlingly accurate .,4.0,2020-09-13 16:06:48,10.0,0.129,0.495,0.376,0.5423
127,10,I do n't understand the cactus ?,3.0,2020-09-13 11:23:27,10.0,0.0,1.0,0.0,0.0
128,11,This is my favourite meme and every picture is perfect,2.0,2020-09-13 14:33:06,10.0,0.0,0.709,0.291,0.5719
129,12,Pain and misery with small reward,2.0,2020-09-13 20:42:12,10.0,0.511,0.219,0.27,-0.5106
130,13,"I find it much easier to horde pepper poppers than the eels , since you can make insane amounts of peppers and cheese without putting too much effort into it",25.0,2020-09-13 09:51:09,10.0,0.081,0.836,0.084,0.0258
131,14,Game Theory : the farmer is immortal,4.0,2020-09-13 14:14:19,10.0,0.0,0.75,0.25,0.25
132,15,I started a sea cucumber pond relatively early on to farm lucky lunches,3.0,2020-09-13 20:11:02,10.0,0.0,1.0,0.0,0.0
133,16,[,35.0,2020-09-13 10:06:11,10.0,0.0,1.0,0.0,0.0
134,17,with the * WHAT *,21.0,2020-09-13 12:03:43,10.0,0.0,1.0,0.0,0.0
135,18,I make wood fences and trap them in a corner ( both the dummies and the dinosaurs ),11.0,2020-09-13 12:26:11,10.0,0.0,1.0,0.0,0.0
136,19,I go behind them and just start slashing away,8.0,2020-09-13 12:03:54,10.0,0.208,0.792,0.0,-0.2732
137,20,"Ah , yes . Snails sashimi",3.0,2020-09-13 16:33:58,10.0,0.0,0.649,0.351,0.4019
138,21,"Make sure you have the quest from mr qi to get to lvl 100 , only then will your event happen",3.0,2020-09-13 18:06:22,10.0,0.0,0.897,0.103,0.3182
139,22,cactus fruit,7.0,2020-09-13 12:04:10,10.0,0.0,1.0,0.0,0.0
140,23,oh I just pick the ones on the ground on my way to Skull Cavern,4.0,2020-09-13 12:32:31,10.0,0.0,1.0,0.0,0.0
141,24,True . That +luck though .. $ $ $,10.0,2020-09-13 10:09:01,10.0,0.0,0.547,0.453,0.7003
142,25,Wtf,13.0,2020-09-13 14:13:54,10.0,1.0,0.0,0.0,-0.5859
143,26,I am concerned that you had this really,8.0,2020-09-13 18:24:37,10.0,0.0,1.0,0.0,0.0
144,27,"Holy friggin Yoba that 's genius . I always forget you can place loads of stuff nearly anywhere on the map , not just the farm .",10.0,2020-09-13 13:34:21,10.0,0.068,0.932,0.0,-0.2263
145,28,The Dark Souls approach .,6.0,2020-09-13 13:33:09,10.0,0.0,1.0,0.0,0.0
146,29,More like periwinkle and carp ... Shout out to that one statue near Krobus in the late game .,2.0,2020-09-13 20:18:11,10.0,0.0,0.866,0.134,0.4201
147,30,Why would you eat cactus fruit if you 're bringing pizza to eat,3.0,2020-09-13 12:28:34,10.0,0.0,1.0,0.0,0.0
148,31,Ohhh there is that . I guess that accounts for the extra effort . Damn now I have to stock up on eels at the desert swapshop,10.0,2020-09-13 12:59:37,10.0,0.094,0.906,0.0,-0.4019
149,32,Because you pick it up on the way to the mines and then you might get rekt inside,8.0,2020-09-13 14:32:46,10.0,0.0,1.0,0.0,0.0
150,33,"I like it too because it ’ s like a ritual now , I finish my day in the cavern and dump all my rubies for lucky eel",8.0,2020-09-13 13:23:32,10.0,0.08,0.767,0.153,0.34
151,34,Also inventory space,1.0,2020-09-13 22:25:45,10.0,0.0,1.0,0.0,0.0
152,35,Guess it 's time to load rubies into all my crystalariums ! Thanks for the tip,5.0,2020-09-13 13:33:58,10.0,0.0,0.825,0.175,0.4926
153,0,Clint 's open until 4 .,5.0,2020-09-14 02:07:55,11.0,0.0,1.0,0.0,0.0
154,1,lol,1.0,2020-09-14 09:56:39,11.0,0.0,0.0,1.0,0.4215
155,0,"Wait , you guys are coping ?",25.0,2020-09-12 22:06:29,12.0,0.0,1.0,0.0,0.0
156,1,amen,9.0,2020-09-12 21:36:57,12.0,0.0,1.0,0.0,0.0
157,2,I like,5.0,2020-09-12 21:54:59,12.0,0.0,0.286,0.714,0.3612
158,3,Same,6.0,2020-09-13 02:26:40,12.0,0.0,1.0,0.0,0.0
159,4,"Spend sometime in the mines , escapism at its finest . But fr hang in there ❤️",6.0,2020-09-13 04:50:00,12.0,0.0,1.0,0.0,0.0
160,5,"You okay , OP ?",4.0,2020-09-13 03:53:12,12.0,0.0,0.678,0.322,0.2263
161,6,That ’ s how I ’ ve been racking up hours on steam . Something about seeing my chickens walk around is soothing,3.0,2020-09-13 04:48:38,12.0,0.0,0.905,0.095,0.3182
162,7,Extremely relatable content,2.0,2020-09-13 07:20:57,12.0,0.0,1.0,0.0,0.0
163,8,"Wait , you 're guys ?",7.0,2020-09-13 02:09:02,12.0,0.0,1.0,0.0,0.0
164,9,no lmao,10.0,2020-09-13 03:54:02,12.0,0.759,0.241,0.0,-0.4847
165,10,"Wait , your ' e not guys ?",0.0,2020-09-13 07:50:49,12.0,0.0,1.0,0.0,0.0
166,11,hope you feel better soon .,2.0,2020-09-13 05:32:19,12.0,0.0,0.408,0.592,0.7003
167,0,Shane and sam lol,1.0,2020-09-17 07:52:57,13.0,0.0,0.517,0.483,0.4215
168,0,I feel the same after using a mod that gives me an elevator in the caverns .,11.0,2020-09-13 01:13:07,14.0,0.0,1.0,0.0,0.0
169,1,used a mod that can freeze time and ive never felt so guilty when i encountered this lol,3.0,2020-09-14 22:10:52,14.0,0.157,0.65,0.193,-0.0429
170,2,Well I used those stairs made of stone so it was n't an honourable way ...,1.0,2020-09-17 02:48:49,14.0,0.145,0.855,0.0,-0.3724
171,3,Lol same,5.0,2020-09-13 03:07:09,14.0,0.0,0.263,0.737,0.4215
172,0,I read this in Mona-Lisa 's voice and I loved it,31.0,2020-09-12 07:35:11,15.0,0.0,0.719,0.281,0.5994
173,1,I am absolutely DELIGHTED by this meme !,20.0,2020-09-12 07:39:54,15.0,0.0,0.603,0.397,0.6826
174,2,My honey gathering inner monologue will forever bee changed,10.0,2020-09-12 08:32:03,15.0,0.0,1.0,0.0,0.0
175,0,"I wanted to say thanks again in the comments , for the insane support . thank you sooo much ! ! ! ❤❤❤",1.0,2020-09-12 06:47:06,17.0,0.06,0.464,0.477,0.9632
176,0,That 's so true,2.0,2020-09-11 14:38:38,18.0,0.0,0.453,0.547,0.5598
177,0,I have a wealth clock yet she somehow repaired my fences ? She best not have lol,2.0,2020-09-15 05:00:57,19.0,0.098,0.59,0.312,0.7243
178,0,"I like how when you deliver it , she mistakes it as a gift from you that you bought from Clint",11.0,2020-09-11 19:29:03,20.0,0.097,0.695,0.208,0.4404
179,1,"I see you are a man/woman of good taste as well . After Haley asked me to tell Alex hello , I immediately decided to wed Emily lmao",3.0,2020-09-11 15:43:19,20.0,0.0,0.793,0.207,0.7783
180,2,lol,1.0,2020-09-14 09:58:13,20.0,0.0,0.0,1.0,0.4215
181,3,Her response is priceless ! It 's even better IMO when you 're just friends with her .... but OP being married to her is pretty great too ...... poor Clint ^ ( kinda ),1.0,2020-09-15 04:00:38,20.0,0.086,0.62,0.294,0.8777
182,0,I feel so attached to mine lol I was going to sell some ducks but then I couldn ’ t do it because I loved them too much . Now they have names like Money and Cash😅,26.0,2020-09-10 12:33:47,21.0,0.0,0.729,0.271,0.9294
183,1,Same . I teared up when I got my first rabbit,11.0,2020-09-10 14:49:03,21.0,0.0,1.0,0.0,0.0
184,2,"I understand this completly , I named one of the cows after my favourite cow in real life who had to be euthanised because she was old and sick . ( and when I mean old I mean actually old by today 's cattle standard ) I loved her dearly and now I have something to remember her by",9.0,2020-09-10 21:22:42,21.0,0.05,0.848,0.102,0.5267
185,3,"I love this ! I love my animals too but I 'm not great at thinking up names on the spot so they are all named Cow 1 , Cow 2 , Duck 1 , Duck 2 ...",3.0,2020-09-11 04:18:48,21.0,0.099,0.779,0.122,-0.1363
186,4,THIS .... my friends make fun of my because I have all the names of my chickens memorized,2.0,2020-09-15 04:01:45,21.0,0.0,0.714,0.286,0.7506
187,5,Ive seen this post a few times now and i feel each time it belongs in a wholesome subreddit lol,2.0,2020-09-17 01:31:34,21.0,0.0,0.872,0.128,0.4215
188,6,# epicmood,1.0,2020-09-11 07:30:30,21.0,0.0,1.0,0.0,0.0
189,7,"oh that ’ s absolutely valid , i have two cows and their names are ‘ moo ’ and ‘ moomoo ’",2.0,2020-09-11 04:55:09,21.0,0.0,1.0,0.0,0.0
190,8,"join the club friend , same here LOL",2.0,2020-09-15 04:10:13,21.0,0.0,0.359,0.641,0.8374
191,9,YAS I ’ m so happy I ’ m not the only one 😭 I also have a running joke in my headcanon that my farmer is terrible at naming chickens so the names keep getting more and more absurd . ( I ’ m gon na try to draw it eventually ),2.0,2020-09-15 04:54:18,21.0,0.097,0.795,0.108,0.188
192,0,I can relate so much,9.0,2020-09-10 13:55:37,22.0,0.0,1.0,0.0,0.0
193,1,But if they ’ re all pigs and you have iridium foraging then it doesn ’ t matter ; ),8.0,2020-09-11 01:00:44,22.0,0.0,0.943,0.057,0.0387
194,2,The first time I played I did n't realize I had to feed my animals in the winter . They survived .,7.0,2020-09-11 01:19:58,22.0,0.0,0.778,0.222,0.6908
