,Unnamed: 0,Reply,Upvote,Time,Key,neg,neu,pos,compound
2497,18,"wow ! thank u for the notes . winter 28 is galaxy brain tbh ... and lol ok yes , i heard abt the bachelo weapons , but did n't connect that since it was just 1 mentioned . if i may , what about the bus to comatose , the 2 warps , and the 6am festival exploit ?",11.0,2020-07-08 13:01:54,359.0,0.051,0.747,0.202,0.8605
2498,19,Thank you ! I was wondering about the I guess they never miss huh,1.0,2020-07-09 10:12:07,359.0,0.0,0.739,0.261,0.5
2499,20,"bus to comatose is the conspiracy that the first time you travel to the desert via the bus , you get into an accident , fall into a coma , and everything else that happens is imagined , hence why weird things start happening afterwards ( usually players unlock the desert around when less `` realistic '' events start occurring ) Gate bomb warp is a 1.3 bug where you could put a fence down on floor 120 of the mines , bomb it , and that would create a ladder which would take you to floor 1 of skull cavern SC wrong warp is a bug which afaik still exists where sometimes on SC treasure floors , you can click the wall and it will put up the normal mines elevator menu that you can use to travel to the mines 6AM festival exploit is if you travel into a festival area on the day of the festival at 6AM sharp , the game will not prevent you from entering ( normally it blocks you and says `` festival is being set up etc '' )",11.0,2020-07-08 14:06:32,359.0,0.105,0.824,0.071,-0.6339
2500,21,thank u 4 all ur wisdoms :0,2.0,2020-07-09 01:39:45,359.0,0.0,0.706,0.294,0.3612
2501,0,"Pierre is an a-hole though . I 'll support Marnie and Robin and Sandy and Clint and the Traveling Merchant , but I 'd rather not give money to Pierre if I do n't have to . Edit : For the record , fuck Joja Mart too . I get all my seeds from the Oasis and the Traveling Merchant .",44.0,2020-07-07 19:22:09,360.0,0.072,0.899,0.028,-0.5994
2502,1,Joja probably took a PPP loan even though they shouldn ’ t have,11.0,2020-07-08 01:29:29,360.0,0.0,1.0,0.0,0.0
2503,2,they try to steal our land those pieces of shit,3.0,2020-07-07 20:31:46,360.0,0.459,0.541,0.0,-0.7783
2504,3,and Wednesdays ! !,3.0,2020-07-08 04:13:01,360.0,0.0,1.0,0.0,0.0
2505,4,I ’ ve never bought anything from jojamart because fuck jojamart,2.0,2020-07-10 16:55:02,360.0,0.259,0.741,0.0,-0.5423
2506,5,"To some extent , the arc of the game is about going from utter reliance on shops like Pierre 's and Joja to late-game where you are totally independent and can provide for yourself completely .",24.0,2020-07-07 20:24:04,360.0,0.0,0.933,0.067,0.3612
2507,6,Wednesday can go to hell ! !,1.0,2020-07-10 17:36:06,360.0,0.464,0.536,0.0,-0.7339
2508,7,ur telling me,1.0,2020-07-10 16:58:56,360.0,0.0,1.0,0.0,0.0
2509,0,It ’ s unbelievable the amount of subtle details put into this ! Truly a modern work of art .,6.0,2020-07-08 07:41:41,361.0,0.0,0.783,0.217,0.6114
2510,1,I like Morris,1.0,2020-07-12 17:51:56,361.0,0.0,0.444,0.556,0.3612
2511,2,Expected some top tier cosplay . You got me there lol,3.0,2020-07-09 18:39:11,361.0,0.0,0.662,0.338,0.5574
2512,3,this is on the meme subreddit do n't expect anything,1.0,2020-07-09 21:28:54,361.0,0.0,1.0,0.0,0.0
2513,0,Is he the doctor that was on the [ news ? ],26.0,2020-07-07 01:47:05,362.0,0.0,1.0,0.0,0.0
2514,1,Bring Grape .,13.0,2020-07-07 01:49:15,362.0,0.0,1.0,0.0,0.0
2515,2,"Dissect is the term used for cutting open plants , too . Dissecting fruit is something done in a lot of elementary schools .",12.0,2020-07-07 02:46:38,362.0,0.061,0.939,0.0,-0.128
2516,3,He did surgery on a grape,13.0,2020-07-07 04:18:26,362.0,0.0,1.0,0.0,0.0
2517,4,An actual good use of this grape meme .,9.0,2020-07-07 05:33:04,362.0,0.0,0.734,0.266,0.4404
2518,5,He did surgery on a Grape,7.0,2020-07-07 08:18:58,362.0,0.0,1.0,0.0,0.0
2519,6,"Me , an IRL farmer : well , it 's common for scientists to dissect fruits and vegetables from farms in order to examine certain organisms that may be insi -- This whole comment section : S U R G E R Y O N A G R A P E",3.0,2020-08-06 13:25:36,362.0,0.0,0.96,0.04,0.2732
2520,7,No,5.0,2020-07-07 00:52:23,362.0,1.0,0.0,0.0,-0.296
2521,8,"1 . Dissect does not mean surgery . He wants to see how a grape is structured on the inside . 2 . If it was surgery , grapes , eggs , oranges etc . are really good training patients to learn sutures .",2.0,2020-07-07 11:16:55,362.0,0.0,0.931,0.069,0.4927
2522,9,O M G,2.0,2020-07-07 11:28:42,362.0,0.0,1.0,0.0,0.0
2523,10,Bring Demetrius G R A P E,2.0,2020-07-07 16:51:19,362.0,0.0,1.0,0.0,0.0
2524,11,"It 's what he does , he 's the grapist",2.0,2020-07-09 11:07:34,362.0,0.0,1.0,0.0,0.0
2525,12,"I do n't remember what exactly she was doing , but my sister had to practice on a grape for something in medical school .",10.0,2020-07-07 05:44:52,362.0,0.0,1.0,0.0,0.0
2526,13,they did surgery on a grape ! ?,6.0,2020-07-07 09:46:30,362.0,0.0,1.0,0.0,0.0
2527,14,Boo [ Davinci Robotics ] Anyone can make a better machine !,3.0,2020-07-07 14:44:44,362.0,0.0,0.775,0.225,0.4926
2528,15,I didn ’ t know Demetrius ’ last name was Grape .,8.0,2020-07-07 04:41:42,362.0,0.0,1.0,0.0,0.0
2529,16,G R A P E,6.0,2020-07-07 02:53:32,362.0,0.0,1.0,0.0,0.0
2530,17,"We did it at my university too . And we got to eat them afterwards , which was nice .",9.0,2020-07-07 02:55:39,362.0,0.0,0.872,0.128,0.4215
2531,18,They did surgery on a grape ...,2.0,2020-07-07 18:22:16,362.0,0.0,1.0,0.0,0.0
2532,19,He did surgery on a grape,10.0,2020-07-07 05:27:57,362.0,0.0,1.0,0.0,0.0
2533,20,"I would n't go * that * far , but I am glad people are enjoying it .",5.0,2020-07-07 05:38:12,362.0,0.0,0.65,0.35,0.8625
2534,21,Yes,3.0,2020-07-07 01:14:13,362.0,0.0,0.0,1.0,0.4019
2535,22,They did surgery on a grape .,2.0,2020-07-07 18:22:58,362.0,0.0,1.0,0.0,0.0
2536,23,Probably the surgery robot ! For laparoscopic surgeries ?,3.0,2020-07-07 06:39:39,362.0,0.0,1.0,0.0,0.0
2537,24,lol yes,4.0,2020-07-07 13:28:05,362.0,0.0,0.0,1.0,0.6705
2538,25,Dad ’ s dead !,4.0,2020-07-07 06:27:21,362.0,0.534,0.466,0.0,-0.68
2539,0,[ psssst ... I 'll just leave this here ],3.0,2020-07-13 19:09:52,364.0,0.118,0.882,0.0,-0.0516
2540,0,“ I ’ m gon na keep this as a reminder of how much I hate it . ”,9.0,2020-07-07 01:45:30,365.0,0.171,0.829,0.0,-0.5719
2541,1,Me thinking `` haley likes flowers ! '' and giving her a dandelion : (,4.0,2020-07-08 02:35:40,365.0,0.0,0.703,0.297,0.6696
2542,0,Me too ! Harvey fans Unite !,6.0,2020-07-07 19:09:36,366.0,0.0,1.0,0.0,0.0
2543,1,Penny is best girl,3.0,2020-07-10 11:07:42,366.0,0.0,0.417,0.583,0.6369
2544,2,I just marry every men in SDV that I can with mods .,1.0,2020-07-07 01:41:49,366.0,0.0,1.0,0.0,0.0
2545,3,Harvey is great,1.0,2020-07-15 04:20:25,366.0,0.0,0.328,0.672,0.6249
2546,0,Abigail is quaking,10.0,2020-07-06 23:11:59,367.0,0.556,0.444,0.0,-0.3612
2547,1,When your doctor says you need more vitamins and minerals in your diet,2.0,2020-07-07 01:19:58,367.0,0.0,1.0,0.0,0.0
2548,2,Its supposed to,2.0,2020-07-09 00:25:27,367.0,0.0,1.0,0.0,0.0
2549,0,Damnit Clint how many copper ores do you really need ! ? !,56.0,2020-07-06 04:06:12,368.0,0.249,0.751,0.0,-0.6103
2550,1,"no pierre , i 'm not giving you a melon in the middle of winter",22.0,2020-07-06 08:51:44,368.0,0.246,0.754,0.0,-0.5
2551,2,"This is me , except that now I ’ m trying to get the gofer achievement ( I believe that ’ s the one with 40 , but I ’ m trying the one with 40 ) but after getting it it ’ s gon na be the exact same , so can relate",4.0,2020-07-06 08:57:40,368.0,0.0,1.0,0.0,0.0
2552,3,LOL this is where strategy comes in . Like : * keeping at least one or 2 of the items that come get requested in job quests * make a schedule of going to the mines to kill monsters or gathering quests around these quest times * go fishing while using stardew wiki to know where to find the fish or going back to point 1 if it 's only a delivery quest You can get more info here under help wanted > types : [,2.0,2020-07-06 18:41:32,368.0,0.049,0.859,0.092,0.4648
2553,4,O my goodness . It seems like I ’ ll do them and half of the time won ’ t talk to the folks afterward . Between their agendas I ’ m so detached from atp and my schedule it ’ s like damn here I am slaying slimes for nothing but points towards Gil ’ s thing,2.0,2020-07-18 14:23:33,368.0,0.053,0.823,0.124,0.543
2554,5,"And he just inspects them , doesnt do anything with them . Like what does he do with the ores in that cabin ?",32.0,2020-07-06 04:28:34,368.0,0.0,0.902,0.098,0.3612
2555,6,I try to save a few of each crop because they seem to be asked for as soon as you can ’ t get them anymore,8.0,2020-07-06 14:08:19,368.0,0.0,0.887,0.113,0.4939
2556,7,"Thank you ! : ) I do n't get point # 1 though . Whenever I get a gathering quest , they 'll only accept the item if I gather it during that 2-days span ... So keeping them in my inventory is kind of useless",1.0,2020-07-07 00:56:54,368.0,0.06,0.835,0.105,0.318
2557,8,He talks to them . Poor guy is too socially awkward .,20.0,2020-07-06 06:14:59,368.0,0.32,0.68,0.0,-0.5719
2558,9,clever,2.0,2020-07-06 14:11:24,368.0,0.0,0.0,1.0,0.4588
2559,10,"There are people that ask for certain items and you are not required to get a fresh one . The only thing you are required to get fresh ( that I can remember ) would be ores . Some people ask for fish , vegetables , fruits , minerals , or artisan good even if they are out of season . So you need to keep at least one of each item . For example , you get a request for parsnip ... in summer . Or an octopus .. Etc",2.0,2020-07-07 04:05:58,368.0,0.0,0.901,0.099,0.8225
2560,11,Plus you have to actually go and get new ones . K have over 1000 ore in my chest Clint .,10.0,2020-07-06 08:27:57,368.0,0.0,1.0,0.0,0.0
2561,12,Ah I see . Thank you !,1.0,2020-07-07 04:08:53,368.0,0.0,0.682,0.318,0.4199
2562,13,Ikr ? ! The first time I accepted one of those because I had a lot of copper ores ... Then he would n't take any . Disappointing : (,7.0,2020-07-06 08:59:58,368.0,0.104,0.834,0.063,-0.3382
2563,14,"I think you can actually work around this by putting all your ores and in a chest , then take out the exact amount one at a time .",2.0,2020-07-10 19:12:33,368.0,0.0,1.0,0.0,0.0
2564,15,Then you accidentally gift them to him and he gets mad because he does n't like getting ores ! !,9.0,2020-07-06 11:48:58,368.0,0.305,0.588,0.107,-0.6591
2565,16,"Like , ffs , I 'm giving you resources for free , have the decency to like me a little !",3.0,2020-07-06 11:59:15,368.0,0.123,0.52,0.357,0.7345
2566,17,Maybe he sees it as a show of power . Since he is the one place in town you can buy ore from .,3.0,2020-07-06 13:31:28,368.0,0.0,1.0,0.0,0.0
2567,18,I HAVE THE HIGH GROUND !,2.0,2020-07-07 00:58:31,368.0,0.0,1.0,0.0,0.0
2568,19,"Clint : YOU UNDERESTIMATE MY POWE ... oh God it 's Emily , got ta hide ....",2.0,2020-07-07 01:07:26,368.0,0.223,0.675,0.101,-0.368
2569,0,"Seriously , man . Penny just stands around the house . I give her one of her favorite things every day and the best I can hope to receive from her is a pancake . It 's especially annoying when she meets me outside near all my iridium sprinklers and says she got up early to water the crops . That is completely unnecessary and would probably take her the entire night , lol",23.0,2020-07-06 13:55:56,369.0,0.055,0.794,0.151,0.8484
2570,1,Shane changed my bedroom to joja wallpaper so I divorced him and wiped his memory .,13.0,2020-07-12 09:01:49,369.0,0.0,1.0,0.0,0.0
2571,2,"There are mods for married life for most npc . I recommend you check ot out , improved my marriage with Maru",6.0,2020-07-07 00:00:00,369.0,0.0,0.781,0.219,0.6808
2572,3,I may sound weird but .... Even after five in-game years of being married to Elliot he still makes me feel warm and fuzzy ... Maybe the dialogue expansion mod helps but his EXTREMELY CHEESY lines felt like Cupid piercing my heart with a hundred arrows per single shot even before I installed it !,4.0,2020-07-13 03:29:55,369.0,0.02,0.753,0.227,0.9407
2573,4,eating quartz definitely helps,2.0,2020-07-23 05:16:11,369.0,0.0,0.274,0.726,0.6486
2574,5,Is there a spouse who is n't like this ? ? Emily has a lot less chaotic good energy after you marry her . It feels like she 's striving to be a perfect housewife as opposed to living the wild and free life I admired her for . She 's still very wholesome but she made me happier when she was my friend .,2.0,2020-08-06 13:38:14,369.0,0.044,0.693,0.263,0.9467
2575,6,"Same , I married Leah twice ( 2 play throughs ) . Then got the 7 year itch and ditched her for Penny ( Penny kept dropping hints ) . I could n't make 2 seasons with Penny , thenI married Hailey , and she is awesome . She is attentive , is happy to see me when I get home , cooks all the time . She 's just so fun to have around . & # x200B ; Man do I sound like a complete douche , reading those above 3 sentences ....",20.0,2020-07-07 01:16:12,369.0,0.023,0.81,0.167,0.9397
2576,7,I never get why Shane does this . He hates his job . You 'd think he want to forget,3.0,2020-07-13 05:50:48,369.0,0.208,0.736,0.056,-0.5423
2577,8,"He put gridball wallpaper in the living room and I was about to Mcfricken lose it . But you know what , I have a butterfly hutch and a massive plushy at the foot of our bed , he can have this . As long as he does n't touch the nursery ...",2.0,2020-07-29 13:48:52,369.0,0.034,0.966,0.0,-0.2144
2578,9,Oh my God SAME ! I do n't know what it is ( I 'm a sucker ) but he 's got me wrapped around his dumb finger !,1.0,2020-07-25 20:20:24,369.0,0.208,0.747,0.045,-0.7707
2579,10,"So far , Haley seems to be the best . She 's very affectionate and is constantly talking about how good the lighting is , showing a continued interest in her hobby . I just wish she had a gallery that I could look through from time to time .",1.0,2020-08-06 13:55:20,369.0,0.0,0.738,0.262,0.9432
2580,11,"Hahaha , I felt similarly self-effacing when I posted my comment . We 're * immersed * in this thing , man",7.0,2020-07-07 03:46:17,369.0,0.0,0.854,0.146,0.5574
2581,12,"Whoa , how was Leah ? Was thinking of marrying her .... Of all the bachelorettes , I would choose Hailey the least because of her snarky behavior towards the farmer at first . Might consider her now ! Really like the social aspect of the game , so this part ’ s real important .",5.0,2020-07-09 18:42:40,369.0,0.0,0.917,0.083,0.5974
2582,13,"Would be nice , there is a time and place for everything",1.0,2020-07-09 00:41:17,369.0,0.0,0.797,0.203,0.4215
2583,14,I hadn ’ t had kids with him yet so I divorced him and married Abigail . We are much happier .,1.0,2020-07-29 14:40:49,369.0,0.0,0.861,0.139,0.5267
2584,15,Abigail stays the same too,1.0,2020-09-16 23:54:51,369.0,0.0,1.0,0.0,0.0
2585,16,"Here 's the cool thing about the game . If it ai n't working for you , try a different way . But I 'd say give it a go . I 'm gon na say this though . I have n't tried all the bachelorettes but so far I really love the interactions with Haley .",4.0,2020-07-09 19:04:16,369.0,0.0,0.875,0.125,0.8355
2586,17,Haley evolves as a character,3.0,2020-07-13 19:12:23,369.0,0.0,1.0,0.0,0.0
2587,0,I once got a prismatic shard from the quarry before I barely made it into the mines . Made the mines super easy because I could go grab the sword from the desert and just 1-shot almost all the enemies .,5.0,2020-07-08 13:25:19,370.0,0.065,0.87,0.065,-0.0094
2588,0,"Like , damn I guess I 'll go shop at Joja .",69.0,2020-07-05 23:38:34,371.0,0.178,0.658,0.164,-0.0516
2589,1,she needs a tv program at CW called Stars In Our Valley,23.0,2020-07-06 00:18:01,371.0,0.0,1.0,0.0,0.0
2590,2,"Lady , you only sell like ... 10 things",17.0,2020-07-06 03:55:03,371.0,0.0,0.762,0.238,0.3612
2591,3,LOL what mods are in this ?,15.0,2020-07-06 01:40:40,371.0,0.0,0.629,0.371,0.5473
2592,4,Why are their clothes different ?,5.0,2020-07-06 03:49:52,371.0,0.0,1.0,0.0,0.0
2593,5,Ah I have a few installed ... I think this is because of the stardew valley dialogue expansion mod ... makes the game a lot more interesting !,13.0,2020-07-06 03:58:45,371.0,0.0,0.892,0.108,0.5081
2594,6,Would also like to know,3.0,2020-07-06 03:05:12,371.0,0.0,0.615,0.385,0.3612
2595,7,There 's a mod called seasonal villager outfits . It 's really great .,8.0,2020-07-06 03:59:18,371.0,0.0,0.747,0.253,0.659
2596,8,Mods,5.0,2020-07-06 03:52:31,371.0,0.0,1.0,0.0,0.0
2597,0,"Interesting , that she prefers Cave Carrot to Cucumber ... Of course I gave it to her , too ! The Cave Carrot , of course ... 😉😁",5.0,2020-07-06 03:25:50,372.0,0.0,0.842,0.158,0.7177
2598,1,She once asked for a catfish and a super cucumber on the help wanted board 😂,2.0,2020-07-09 19:06:07,372.0,0.075,0.669,0.256,0.6808
2599,2,oH nOoOoO,1.0,2020-07-06 14:03:26,372.0,0.0,1.0,0.0,0.0
2600,3,hol up,1.0,2020-07-16 15:03:23,372.0,0.0,1.0,0.0,0.0
2601,4,[ Kinda cringe bro ngl ],-2.0,2020-07-06 05:26:09,372.0,0.0,1.0,0.0,0.0
2602,5,I was talking to Alex the other day and he said ( or something very similar ) “ did you see what Haley asked for on the help wanted poster ? ? ? A CAVE CARROT ? ” And his face was shocked . I laughed pretty hard but didn ’ t have my phone to record it lol,9.0,2020-07-06 03:50:26,372.0,0.043,0.797,0.16,0.8299
2603,6,"I thought it was notable that a game would include this , because it 's very sex-positive . It was surprising in a positive way , Bro .",10.0,2020-07-06 05:36:33,372.0,0.0,0.82,0.18,0.6908
2604,7,"🤣🤣 Look , Alex , there 's nothing shocking about taking care of your needs ! Lol",3.0,2020-07-06 04:42:32,372.0,0.0,0.584,0.416,0.9319
2605,8,Exactly !,3.0,2020-07-06 06:45:59,372.0,0.0,1.0,0.0,0.0
2606,0,“ You ’ re reminded of the taste of Adam Driver. ” I used “ cats ” my first ever play through and hm . Did not like that .,7.0,2020-07-05 19:37:55,373.0,0.065,0.861,0.074,0.0747
2607,1,DO NOT COMPARE ME TO ✡️STARDROP ! ( Yes I know its the star of David . It was the best I could find . ),2.0,2020-07-07 14:35:09,373.0,0.0,0.783,0.217,0.8016
2608,2,Crosspost this to /,2.0,2020-07-06 02:45:41,373.0,0.0,1.0,0.0,0.0
2609,3,"I was gon na say , is that you John ?",2.0,2020-07-06 02:49:48,373.0,0.0,1.0,0.0,0.0
2610,0,Did that in my greenhouse with an ancient fruit near a blueberry bush ... just cried and restarted my day .,62.0,2020-07-05 02:25:36,374.0,0.115,0.885,0.0,-0.3818
2611,1,This is why you harvest with right-click .,15.0,2020-07-05 05:29:02,374.0,0.0,1.0,0.0,0.0
2612,2,I make it a point to either equip my scythe or an empty spot when I 'm not using a specific tool lol too many accidents,9.0,2020-07-05 09:02:37,374.0,0.137,0.769,0.094,-0.0772
2613,3,When you have a 14 heart relationship with the Adventurer 's Guild,7.0,2020-07-05 06:20:13,374.0,0.0,0.61,0.39,0.7506
2614,4,Does console not have an equivalent to right click ?,5.0,2020-07-05 18:43:00,374.0,0.0,1.0,0.0,0.0
2615,5,That 's why you make a habit to use right click when harvesting .,3.0,2020-07-05 14:41:58,374.0,0.0,1.0,0.0,0.0
2616,6,Right click gang rise up .,3.0,2020-07-05 16:04:33,374.0,0.0,1.0,0.0,0.0
2617,7,My friend introduced me to Stardew by having me visit her farm in multiplayer and this was the first thing I did ...,3.0,2020-07-05 16:24:53,374.0,0.0,0.873,0.127,0.4939
2618,8,I would 've done the same,6.0,2020-07-05 14:42:12,374.0,0.0,1.0,0.0,0.0
2619,0,Give him his golden statue,13.0,2020-07-05 00:35:48,376.0,0.0,1.0,0.0,0.0
2620,0,Dunno i believe its something bad according to the color so i didnt eat it,3.0,2020-07-09 00:51:54,377.0,0.2,0.8,0.0,-0.5423
2621,0,`` EVERDAY '' `` BUT WEDNESDAY WE ARE CLOSED '',61.0,2020-07-04 08:17:05,378.0,0.0,1.0,0.0,0.0
2622,1,The local community center must be under construction,42.0,2020-07-04 08:57:39,378.0,0.0,1.0,0.0,0.0
2623,2,Our local bar also seems to be owned by Pierre ...,25.0,2020-07-04 09:06:05,378.0,0.0,1.0,0.0,0.0
2624,3,Let me in ! ! ! ! LET ! ME ! INNNNNNN ! ! ! ! ! Aharagahah ! !,10.0,2020-07-04 13:13:02,378.0,0.0,1.0,0.0,0.0
2625,4,I guess joja mart is open wednesdays,6.0,2020-07-04 12:03:12,378.0,0.0,1.0,0.0,0.0
2626,5,\ * gasp\ *,3.0,2020-07-04 10:24:49,378.0,0.0,1.0,0.0,0.0
2627,6,I like that they misspelled `` everyday '' but they nailed `` Wednesday '',3.0,2020-07-09 16:06:18,378.0,0.0,0.881,0.119,0.1901
2628,7,It 's Wednesday my dudes,2.0,2020-07-04 22:05:00,378.0,0.0,1.0,0.0,0.0
2629,8,* shocked pikachu face *,1.0,2020-07-04 21:50:38,378.0,0.365,0.635,0.0,-0.3182
2630,9,"Take your hat and your coperation , you will need it . If there is a Morris IRL call him and fight the shop onwer on an old fashioned battle ( just kidding ) : )",1.0,2020-07-05 02:36:38,378.0,0.131,0.833,0.035,-0.5859
2631,10,holy shid i just realized that . how did I not see that sooner . now I 'm just dissapointed,1.0,2020-07-12 14:00:52,378.0,0.0,1.0,0.0,0.0
2632,11,aaaaaaAAAAAAAAAAAAAAAAA,1.0,2020-07-09 16:06:38,378.0,0.0,1.0,0.0,0.0
2633,0,Good . I 'd rather she had a diamond than cash . You ca n't drink away a diamond .,23.0,2020-07-04 08:33:33,379.0,0.0,0.868,0.132,0.4404
2634,1,Her live-savings probably 😂,14.0,2020-07-04 06:37:12,379.0,0.162,0.513,0.325,0.4404
2635,2,I love Pam . One of the first people I max hearts with .,2.0,2020-07-04 09:35:08,379.0,0.0,0.585,0.415,0.8591
2636,3,Sure you can ! Next time on `` Will It Blend '',11.0,2020-07-04 08:56:03,379.0,0.0,0.809,0.191,0.3802
2637,4,"Have you you met Abigail , the mineral eater ?",2.0,2020-07-12 07:08:40,379.0,0.0,1.0,0.0,0.0
2638,5,Pam `` Thishh thiamonthh thathess likhhh bluuuth '',4.0,2020-07-04 09:44:34,379.0,0.0,1.0,0.0,0.0
2639,6,Pam has a drinking problem . Abigail has an eating problem .,2.0,2020-07-12 08:14:00,379.0,0.351,0.649,0.0,-0.6597
2640,0,Stardrops be trippin ',2.0,2020-07-07 14:36:29,380.0,0.0,1.0,0.0,0.0
2641,0,Never feel guilt for the failings of others ! I tried encouraging Clint but he just won ’ t get out of his furnace .,79.0,2020-07-03 14:04:07,381.0,0.066,0.655,0.279,0.7814
2642,1,"Nah , Clint is the ultimate Nice Guy and all he 's missing is a fedora . Emily deserves better .",73.0,2020-07-03 14:27:08,381.0,0.137,0.646,0.217,0.4767
2643,2,I 'll never forget when after marrying Emily > ! I read the letter in Clint 's room and also his event in the saloon ! <,35.0,2020-07-03 13:52:15,381.0,0.0,0.92,0.08,0.3071
2644,3,Took me way too long to realize the `` her '' is Emily and not you accidentally referring to Clint as a female,16.0,2020-07-03 14:26:46,381.0,0.0,0.915,0.085,0.2584
2645,4,"I ca n't bring myself to marry anyone who has a potential romantic thing going on . I mean , I know Clint will never ask Emily out , but I still ca n't do it . Ca n't come between Seb and Abi either , you know they 're crushing on each other . And what 's the point marrying Harvey when at heart , he 's into Maru ? I do n't want to be second best . Yes I know it 's just a game lol , but still .",11.0,2020-07-04 00:41:16,381.0,0.041,0.773,0.186,0.9591
2646,5,"He keeps giving me stones in my geodes , he deserves it",6.0,2020-07-04 05:52:25,381.0,0.0,0.821,0.179,0.34
2647,6,I wish I could marry Clint,-2.0,2020-07-03 15:41:49,381.0,0.0,0.649,0.351,0.4019
2648,7,I almost divorced Emily because Clint is just so sweet . ( i have said this a few times on this subreddit ),-5.0,2020-07-03 14:02:35,381.0,0.0,0.942,0.058,0.0941
2649,8,not funny dude,-2.0,2020-07-03 12:45:06,381.0,0.546,0.454,0.0,-0.3412
2650,9,If you found him in his furnace I do n't think he 's getting out any time soon,56.0,2020-07-03 14:25:59,381.0,0.0,1.0,0.0,0.0
2651,10,"I wish there was another option than to give Emily the amethyst for him , it ’ s so cringey like do it yourself dude you go to her job and sit across from her every night ! !",12.0,2020-07-03 22:00:51,381.0,0.0,0.859,0.141,0.7238
2652,11,I deliberately timed it so my wedding to Emily fell on Clint 's birthday .,14.0,2020-07-04 04:59:59,381.0,0.0,1.0,0.0,0.0
2653,12,Dude it was funny just him confiding his feelings for Emily and you ’ re just sitting there like “ Dude ... you were at my wedding ! ”,33.0,2020-07-03 18:55:11,381.0,0.0,0.826,0.174,0.69
2654,13,Are n't all of the bachelorettes/bachelor 's into one of the other group ?,6.0,2020-07-04 01:06:08,381.0,0.0,1.0,0.0,0.0
2655,14,... Why would you divorce your wife who loves you for a loser that could never confess ? She 's not a piece of property you pawn off to whoever you pity the most,4.0,2020-07-04 03:09:25,381.0,0.139,0.769,0.092,-0.2263
2656,15,Lmao ... yeah it gets hot in there ...,11.0,2020-07-03 15:11:48,381.0,0.0,0.534,0.466,0.7269
2657,16,😂😂😂,3.0,2020-07-04 05:02:45,381.0,0.218,0.345,0.437,0.8271
2658,17,I 'm dying 😂😂😂😂😂😂😂,1.0,2020-07-15 15:38:16,381.0,0.208,0.376,0.416,0.9601
2659,18,"It 's more explicit for some . Like I know they will all pair off at the flower dance unless you intervene , but someone like Shane does n't have any close friends or , as far as I know , any dialogue suggesting he likes anyone . Whereas Harvey has dialogue suggesting he pines after Maru , and Seb and Abi are constantly shipped by Sam .",5.0,2020-07-04 01:14:12,381.0,0.0,0.833,0.167,0.9161
2660,19,"Can confirm , hid in the furnace for hide and seek and i havent cooled down to below 500°c since i got in there",8.0,2020-07-03 20:19:16,381.0,0.124,0.876,0.0,-0.2732
2661,20,I can see that . I know Penny and Sam always give off the vibe that there might be something going on there . Has n't stopped me from destroying that blossoming romance to marry the school teacher .,8.0,2020-07-04 01:16:06,381.0,0.08,0.802,0.117,0.1695
2662,21,Haley asks you to say hi to Alex for her,4.0,2020-07-04 13:07:42,381.0,0.0,1.0,0.0,0.0
2663,22,"Oh Haley , I think I may marry her on my new playthrough .",2.0,2020-07-04 13:09:55,381.0,0.0,1.0,0.0,0.0
