,Unnamed: 0,Reply,Upvote,Time,Key,neg,neu,pos,compound
782,3,"Yup , I kinda thought it was intentional you have to wait until after winter since that ’ s what happened to me on my first play through .",17.0,2020-08-20 17:39:17,121.0,0.0,0.921,0.079,0.34
783,4,Without context this is such a strange post to read . Woke up from a nap and didn ’ t know what sub this was posted on and it took me a few reads fo realize hahaha,3.0,2020-08-21 07:10:21,121.0,0.0,0.909,0.091,0.5574
784,5,Laughs in rain totem gang,2.0,2020-08-21 08:54:10,121.0,0.0,0.556,0.444,0.4939
785,6,It does !,36.0,2020-08-20 20:25:56,121.0,0.0,1.0,0.0,0.0
786,7,"He ’ s so bitchy about it too , whining about how he ’ ll be alone forever . Meanwhile , Sebastian is just happy to be involved .",26.0,2020-08-21 01:39:27,121.0,0.221,0.679,0.1,-0.5332
787,8,For proposing you need to give your partner a Mermaid ‘ s Pendant . You can obtain it from the the ghost of the old mariner who only appears on rainy days at the beach .,28.0,2020-08-20 18:59:02,121.0,0.036,0.964,0.0,-0.0772
788,9,"In addition to what said , you can only get the Pendant from the Old Mariner if you 're already at 10 hearts with a villager , have given them the bouquet , and have the first house upgrade , meaning you ca n't really prep in advance and get it before it 's time to propose ( unless you intend to hold off on proposing for a while anyway , but most people want to do it as soon as they meet the conditions ) .",3.0,2020-08-21 13:54:51,121.0,0.0,0.95,0.05,0.545
789,10,"Sebastian is in my up-and-coming list , but I still have n't gotten around to making a file to court him yet . If my memory serves me correctly , one of the secret notes says that Elliott is one of the older bachelors , so it makes sense why he would come off whiny about being alone forever . He 's getting to an age where he probably expected to already have a family , and here he is living in a little shack on the beach all alone . Poor guy .",10.0,2020-08-21 04:52:11,121.0,0.091,0.909,0.0,-0.8462
790,0,God I need a autofeeder so bad !,1.0,2020-08-23 01:18:04,122.0,0.371,0.466,0.163,-0.5695
791,0,I do n't think so . Shane is n't super attractive in the first place . I think they like Shane for his redemption arc . So Clint might get the same treatment if he had a redemption arc too,29.0,2020-08-20 17:50:39,124.0,0.056,0.886,0.058,0.0243
792,1,bold of you to assume I 'm not attracted to both,7.0,2020-08-21 04:03:45,124.0,0.167,0.646,0.187,0.069
793,2,Clint is hot af what ?,8.0,2020-08-21 07:02:19,124.0,0.0,1.0,0.0,0.0
794,3,I ’ m a Shane fan married to him and think he ’ s super cute,4.0,2020-08-20 22:38:18,124.0,0.0,0.725,0.275,0.6486
795,4,"Me and Shane are always bestfriends no matter the save file and if he looked like Clint I 'd still love him . ( Also Clint is our little akward man , so I love him too )",3.0,2020-08-25 02:14:47,124.0,0.022,0.681,0.297,0.9361
796,5,"looks are n't everything , it 's all about the redemption arc babyyyy",3.0,2020-08-25 12:32:48,124.0,0.0,1.0,0.0,0.0
797,6,I like awkward man Clint,2.0,2020-08-20 17:51:12,124.0,0.225,0.423,0.352,0.2263
798,7,Yes,5.0,2020-08-20 19:29:39,124.0,0.0,0.0,1.0,0.4019
799,8,Clint is bae,6.0,2020-08-26 00:32:40,124.0,0.0,1.0,0.0,0.0
800,0,Stardew valley is my happy place,8.0,2020-08-20 15:25:11,125.0,0.0,0.575,0.425,0.5719
801,1,"I love this , if I didn ’ t spend all my money on amiibo I would give this an award",3.0,2020-08-20 10:56:22,125.0,0.0,0.712,0.288,0.8271
802,2,Too real . My brain feels better but my hands sure are cramping !,1.0,2020-08-23 18:04:43,125.0,0.0,0.698,0.302,0.636
803,0,I read that as `` covered in Spain '' and was very confused .,3.0,2020-08-20 13:19:09,126.0,0.166,0.834,0.0,-0.3804
804,0,"I just now realize , is it possible to get 420G at one day by only selling seaweed ?",6.0,2020-08-20 13:27:12,128.0,0.0,1.0,0.0,0.0
805,1,"I believe the answer to that is yes . I spend a lot of time fishing in stardew valley , so I ’ d say that the average time between casts without any boosts is about 1 ingame hour , maybe a little less . You ’ d need 21 seaweed to hit that 420g , and the chance of a seaweed spawn is about 1 in 5 . Therefore , you ’ d need about 105 casts to win . Also , each 10 min ingame is 7 real world seconds . Normally , if you got down to the docks with a beach totem and fished until you passed out , you ’ d get about 4 seaweed . However , we can do much better . If you got consistent bubble luck , we could multiply that 4 seaweed times 4 to get 16 . Wild bait reduces bite time by 5/8 , which we ’ ll just call 1/2 . This doubles our to total to get 32 . Plus , there is the dressed spinner , which reduces bite time by 7.5 seconds . This gives us an insanely fast bite time , it ’ s totally doable",3.0,2020-08-20 15:51:24,128.0,0.009,0.923,0.067,0.9088
806,2,Or you can just fish for several days and sell all the seaweed on one day .,2.0,2020-08-20 16:14:42,128.0,0.0,1.0,0.0,0.0
807,0,"No , do n't do that . Simulated Dating is a lot easier than * actual * dating . If you give him a console , he 'll never leave the cave to invent dating , erasing you from existence .",3.0,2020-08-20 09:34:11,129.0,0.05,0.861,0.089,0.1896
808,1,"Good meme , should have more upvotes",1.0,2020-08-21 01:50:32,129.0,0.0,0.674,0.326,0.4404
809,2,have fun with your 2 hours of charge man,1.0,2020-08-25 13:27:55,129.0,0.0,0.708,0.292,0.5106
810,3,"I do n't care about upvotes at this meme . it 's copy-paste type of format , you just put different stuff",1.0,2020-08-22 09:11:39,129.0,0.111,0.889,0.0,-0.3875
811,0,That 's how mafia works,1.0,2020-08-22 23:12:03,130.0,0.0,1.0,0.0,0.0
812,0,"sILEnCe , LeAH sTAN",10.0,2020-08-19 22:28:21,131.0,0.0,1.0,0.0,0.0
813,1,im just chillin with my best bud krobus,10.0,2020-08-20 02:40:00,131.0,0.0,0.625,0.375,0.6369
814,2,"Love Emily , all my homies love Emily",8.0,2020-08-20 02:14:22,131.0,0.0,0.417,0.583,0.8555
815,3,Haley and I smirk in your general direction,6.0,2020-08-20 03:28:24,131.0,0.0,1.0,0.0,0.0
816,4,i just wish i could marry the dwarf lol,5.0,2020-08-23 03:57:41,131.0,0.0,0.56,0.44,0.6705
817,5,EVERY BACHLORETTE EXCEPT HALEY AND EMILY IS AWESOME -running away-,3.0,2020-08-21 03:45:04,131.0,0.0,0.651,0.349,0.7034
818,6,Why not all the girlfriends,2.0,2020-08-23 09:24:15,131.0,0.0,1.0,0.0,0.0
819,7,"For me , I 'll either marry Emily or Leah .",3.0,2020-08-20 07:07:23,131.0,0.0,1.0,0.0,0.0
820,8,Strange Orb Energy Girl best girl,3.0,2020-08-20 17:27:27,131.0,0.0,0.388,0.612,0.743
821,9,oooo having him as a roommate option in 1.5 would be cool,3.0,2020-08-25 12:34:56,131.0,0.0,0.827,0.173,0.3182
822,10,They 're all great ( except Haley ),1.0,2020-09-02 02:34:19,131.0,0.0,0.631,0.369,0.6249
823,0,Yeah my “ favorite thing ” is kitties and my bf ’ s is puppies -_-,20.0,2020-08-19 17:54:00,132.0,0.0,0.729,0.271,0.6369
824,1,"Ah yes , Dudes .",8.0,2020-08-19 13:16:52,132.0,0.0,0.597,0.403,0.4019
825,2,My vegan friend had the taste of animals,8.0,2020-08-19 22:59:14,132.0,0.0,0.686,0.314,0.4939
826,3,Nice,3.0,2020-08-19 14:14:06,132.0,0.0,0.0,1.0,0.4215
827,4,Am I the only one that puts something offensive,2.0,2020-08-20 01:24:29,132.0,0.273,0.727,0.0,-0.4588
829,6,I always say “ dudes ” like how that one guy in the game House Party says it . “ Doode . ”,1.0,2020-09-08 06:07:29,132.0,0.0,0.802,0.198,0.6369
830,7,Dahmer ?,0.0,2020-08-20 00:31:37,132.0,0.0,1.0,0.0,0.0
831,8,🤣🤣🤣,1.0,2020-08-20 22:24:16,132.0,0.0,0.556,0.444,0.8625
832,9,nice,1.0,2020-08-21 02:48:23,132.0,0.0,0.0,1.0,0.4215
833,10,I usually just put some form of drug there . My current farmer really likes his amphetamines ...,1.0,2020-08-24 02:17:04,132.0,0.0,0.846,0.154,0.4754
834,0,"I will forever assert that this fucker sent me a mail bomb , because the first time he did this , I misclicked and blew up half my farm and died .",144.0,2020-08-19 00:23:01,133.0,0.291,0.709,0.0,-0.9173
835,1,"Wow , it 's been 3 months since a Kent Bomb meme got posted ! My copypasta gets to comes back around ! ! ! Lots of people post this , and I made a theory awhile back and it holds some water , so I post it every time for discussion ! So before he left for the war , I suspect he was the go-to jack of all trades . He can fix the plumbing for Gus or shore up the side of Lewis ’ house for the winter . After a while , they got Demetrius , who definitely was in the same boat , but entranced by his work . Well , lets say a tree fell down and they needed it to be cleared , maybe he got Dem to build him some explosives to make it a pretty quick and dirty job . It was effective , so he got some more and just stored them for later purposes . Then [ war were declared . ] He set off to defend his family , town , and country . While he was away , a little city slicker wandered into town with the deed to the old Farm that sat abandoned above Marnie ’ s place . Kent probably knew the old dude who lived there , but paid him no mind unless there was work . That city slicker , who turns out to be the grandchild of the old farmer , started turning things around rapidly . Not only that , this new farmer was making friends with everyone , helping out around town with the little things , and having a keen eye on some of the younger folk in town to settle down with . This got Kent thinking , he really doesn ’ t need to be the go-to guy anymore , the new farmer is there . He can focus on his wife and kids and be a proper husband and father . So as he is acclimating to everything he finds his little trove of bombs he had made for improvement purposes . He just feels ‘ eh , the farmer can use them now…hear that kid is going into the mines ! ’ and sends them over to you . But that ’ s just a theory ! !",68.0,2020-08-19 03:32:39,133.0,0.051,0.873,0.075,0.8519
836,2,Reasons why Kent scares me : 1 . This tomfuckery,16.0,2020-08-19 04:05:51,133.0,0.211,0.789,0.0,-0.34
837,3,You worried your farmer is gon na get doxxed op ? Lol,13.0,2020-08-19 04:24:31,133.0,0.147,0.667,0.187,0.1531
838,4,"I kinda like getting those . I kinda have it in my head that Kent readjusts to `` normal '' society by opening a mail order Military Surplus Store and selling to the people of the Ferngill Republic . Selling Combat Boots , surplus leather jackets and other stuff to farmers and others .",8.0,2020-08-19 06:00:56,133.0,0.042,0.919,0.039,-0.0498
839,5,I always wonderd why he did that i just blow it up in his house,5.0,2020-08-19 04:03:00,133.0,0.0,1.0,0.0,0.0
840,6,He just wants to be your friend and give you thinks he doesnt need and thinks you might need in the mines : (,7.0,2020-08-19 05:27:02,133.0,0.0,0.878,0.122,0.4939
841,7,I actually made a mod on nexus that changes the bombs he mails you to other items instead,4.0,2020-08-19 04:29:00,133.0,0.0,1.0,0.0,0.0
842,8,"I ca n't say I blame him . He 's overseas , imprisoned , gets PTSD , and comes home and his wife is like , `` Oh , this is A\_Tea\_Daze . We 've become really close friends while you were away . He caught a bass for dinner : ) '' , nothing suspicious there I mean , there is n't since she 's not a candidate but the circumstances made me laugh . I did n't realize Jodi was married when I started playing and then he showed up at my farm , lol",5.0,2020-08-19 07:22:54,133.0,0.018,0.818,0.164,0.9302
843,9,"I 've always assumed he was sending it too you because it 's something he thinks you will need , and itll help him not having a reminder of the war around . He does n't like things that blow up but knows you use them all the time . I never took it as a threat",7.0,2020-08-19 11:49:14,133.0,0.136,0.835,0.029,-0.7754
844,10,Ted Kaczynski who ?,2.0,2020-08-19 16:49:57,133.0,0.0,1.0,0.0,0.0
845,11,It 's even weirder when you 've married his son ...,2.0,2020-08-19 18:31:52,133.0,0.13,0.87,0.0,-0.128
846,12,"Kent was n't deployed , he was hiding in the wilderness and was mailing bombs to various people and writing manifestos",2.0,2020-08-22 02:58:47,133.0,0.099,0.901,0.0,-0.296
847,13,I mean he even added an alibi letter in case it does n't blow up ( `` i was just trying to be a good neighbour '' ),67.0,2020-08-19 00:32:53,133.0,0.0,0.903,0.097,0.4404
848,14,"whew i had no idea , i 'm new to the game . however , great pasta . ( what 's a bit weird is that he sent me this bomb shortly after > ! george told me about his explosives accident . ! < )",29.0,2020-08-19 03:43:55,133.0,0.201,0.727,0.073,-0.7379
849,15,"There 's also that Flower Dance when he first comes back and he says `` I do n't like being in this wide open field it makes me nervous . '' Or something like that . Maybe his PTSD triggered after this mysterious stranger came to town and started asserting themselves into everyone 's lives . Maru and Demetrius have some pretty high tech stuff , and the Wizard is literally a wizard . Power of magic and all that . I could easily see him thinking the farmer is a spy from the enemy .",9.0,2020-08-19 06:06:26,133.0,0.073,0.851,0.077,0.1002
850,16,"This is now canon for me 👍 Although , the `` he 's trying to kill me '' angle is funnier this actually makes sense in-universe",3.0,2020-08-19 09:46:01,133.0,0.145,0.772,0.083,-0.4588
851,17,They probably just used their real name and wish not to have it out there .,7.0,2020-08-19 05:16:37,133.0,0.0,0.847,0.153,0.4019
852,18,"And IIRC there is a mod what adds flowerbombs , with option to replace his bomb presets to them ! There so many good people who care , huh .",2.0,2020-08-19 07:19:02,133.0,0.087,0.732,0.181,0.5378
853,19,"I agree 100 % . It must feel like a punch in the face . Also Jodi would definitely be marriage material , I 'm sure there 's a mod for that PS : There 's no mod for marrying her but a lot of lewd stuff , we probably deserve that mail bomb",4.0,2020-08-19 08:22:11,133.0,0.097,0.788,0.115,-0.2263
854,20,"Just give the old soldier some Dandelions , he warms up quick",6.0,2020-08-19 06:24:08,133.0,0.0,0.84,0.16,0.2732
855,21,"Breaking their marriage up is too depressing for me , even for a modded video game . I 'd happily install one for Caroline since Pierre is a douche ( but Kent is cool ) . And , yes , we do deserve that mail bomb , lol",7.0,2020-08-19 08:28:49,133.0,0.131,0.683,0.187,0.5187
856,22,"Yeah , I just feel guilty because I was trying to bang his wife before I found out she was n't a single mom haha . I ca n't look him in the eyes after all the gifts I gave her .",5.0,2020-08-19 06:26:30,133.0,0.06,0.83,0.111,0.34
857,23,"I wonder if her name was a nod to maybe being able to romance her , and CA took it out . Jody = Guy who 's back home sleeping with your wife while you , a soldier , is deployed . Maybe Jodi was romancable at some point but then you had to deal with Kent ... but CA took that out because it was WAY too spicy for Pelican Town .",8.0,2020-08-19 06:29:26,133.0,0.0,0.969,0.031,0.3182
858,24,"I did n't know that ! TIL Stardew edition haha . Maybe CA named her that so we thought we could court her . The next time he posts we should ask I think its an honest , curious question .",2.0,2020-08-19 16:18:33,133.0,0.0,0.81,0.19,0.8356
859,0,I just got the game like a week ago and I 'm addicted . I have 6 hearts with her right now 😁,2.0,2020-08-26 21:55:19,134.0,0.0,0.71,0.29,0.8689
860,1,"Great , thank you superstar",2.0,2020-08-19 14:04:41,134.0,0.0,0.312,0.688,0.765
861,2,What ? Do what ? Sorry I 'm new to the fandom,2.0,2020-08-20 08:52:40,134.0,0.131,0.869,0.0,-0.168
862,3,Hate people because of their who they like in Stardew Valley,5.0,2020-08-20 09:03:11,134.0,0.243,0.592,0.164,-0.296
863,4,Why is there a picture of Leah there,2.0,2020-08-20 09:04:23,134.0,0.0,1.0,0.0,0.0
864,5,Because she is best girl anybody should know it,2.0,2020-08-20 09:26:55,134.0,0.0,0.656,0.344,0.6369
865,6,I agree,1.0,2020-08-20 09:27:41,134.0,0.0,0.286,0.714,0.3612
866,0,"It ’ s funny because when I do cutscenes I always try to click the “ wisest ” option , but in reality I usually make shitty jokes and insult myself when there ’ s zero reason to do so .",76.0,2020-08-18 09:35:45,135.0,0.18,0.694,0.125,-0.705
867,1,Fr though,20.0,2020-08-18 07:54:42,135.0,0.0,1.0,0.0,0.0
868,2,"Wait , is that a scene from heartstopper on the top ?",11.0,2020-08-18 10:04:37,135.0,0.0,0.859,0.141,0.2023
869,3,"This is so relatable , plus Heartstopper in a Stardey Valley meme < 3",8.0,2020-08-18 10:20:53,135.0,0.0,1.0,0.0,0.0
870,4,Is that Baron ?,5.0,2020-08-18 09:25:51,135.0,0.0,1.0,0.0,0.0
871,5,D. Never on purpose .,5.0,2020-08-18 11:48:47,135.0,0.0,1.0,0.0,0.0
872,6,HEARTSTOPPER !,3.0,2020-08-18 16:29:39,135.0,0.0,1.0,0.0,0.0
873,7,Wiki to the rescue !,3.0,2020-08-18 18:20:16,135.0,0.0,0.527,0.473,0.5562
874,8,Me : Oh hi everyone .... Ummmmmm ....... * frantically opens the wiki *,3.0,2020-08-21 15:47:38,135.0,0.156,0.844,0.0,-0.34
875,9,You know Regis My gut is telling me either A or B but I KNOW for a fact it ’ s D so I ’ ll go with D as my Final answer,1.0,2020-08-18 14:27:37,135.0,0.0,1.0,0.0,0.0
876,10,"Let ’ s be honest , this had happened irl to us as well",1.0,2020-08-19 02:14:42,135.0,0.0,0.798,0.202,0.5106
877,11,Yes it is \^\^ . The way Tori just \ * Appears\ * at random made me burst out laughing when i read it ages ago and kept a screenshot of it . It 's perfect meme material hahaha,11.0,2020-08-18 10:41:15,135.0,0.0,0.726,0.274,0.9217
878,12,All 7 foot 8 of him .,8.0,2020-08-18 13:08:09,135.0,0.0,1.0,0.0,0.0
879,13,It really be like that,3.0,2020-08-18 15:25:06,135.0,0.0,0.59,0.41,0.4173
880,0,Ive been watching this 2 hours now . Its beautifull .,1.0,2020-08-19 09:22:45,136.0,0.0,1.0,0.0,0.0
881,0,“ I don ’ t understand ? Why isn ’ t my dog drinking the rocks I put in his bowl ? ”,22.0,2020-08-18 08:22:23,137.0,0.0,1.0,0.0,0.0
882,1,"Yo since we are on topic here anyways ; is the basic and/or quality retaining soil worth it , especially when I can just spam speed gro or quality fertiliser instead ?",1.0,2020-08-24 02:18:47,137.0,0.073,0.872,0.055,-0.1531
883,0,Bitch imma plant pomegranate until Eliot agrees to marry me,75.0,2020-08-18 03:37:57,138.0,0.279,0.588,0.132,-0.4588
884,1,Whoever made this has never had a properly grown tomato .,68.0,2020-08-18 04:13:13,138.0,0.0,1.0,0.0,0.0
885,2,I do n't think the person who made this has ever eaten a pomegranate or an orange . They should both be at the top of tasty,23.0,2020-08-18 07:31:20,138.0,0.0,0.935,0.065,0.2023
886,3,NO NO NO NO NO POMEGRANATES !,14.0,2020-08-18 04:43:27,138.0,0.119,0.138,0.743,0.8419
887,4,"This is clearly done by someone who likes sweet better than sour . I prefer pomegranates , mango , lemons , sour cherry , Granny Smith apple etc over any other fruit .",13.0,2020-08-18 08:10:13,138.0,0.0,0.781,0.219,0.8126
888,5,Pomegranates are S-tier in tastiness,10.0,2020-08-18 07:29:20,138.0,0.0,1.0,0.0,0.0
889,6,"I feel attacked , pomegranates and lemons are two of my fav fruits",7.0,2020-08-18 08:02:16,138.0,0.176,0.647,0.176,0.0
890,7,Change the lemon and pomegranate and orange cuz they be delicious,6.0,2020-08-18 08:11:02,138.0,0.0,0.73,0.27,0.5719
891,8,"Whoever made that chart has never heard of pomelo . They 're such cumbersome huge blobs , but they 're delectable . They look like oversized grapefruits , have thick skin and you have to tear every last piece of the white bitter crap from inside or you 're gon na choke on awfulness that kills the blissful mood of eating this ancestor of all ( most hybrid ) citruses",3.0,2020-08-18 23:21:11,138.0,0.176,0.658,0.166,-0.25
892,9,Am I the only one who doesn ’ t even notice whether a grape is seedless or not,1.0,2020-08-18 09:38:25,138.0,0.0,1.0,0.0,0.0
893,10,"Mango should be added to sv . Starfruit , but not mango ?",1.0,2020-09-04 05:46:11,138.0,0.0,1.0,0.0,0.0
894,11,Tomato is high key a hand fruit,16.0,2020-08-18 04:20:12,138.0,0.0,0.652,0.348,0.4939
895,12,It ’ s actually used in math classes to demonstrate the effectiveness of a coordinate plane . Source : Am math teacher,8.0,2020-08-18 04:48:41,138.0,0.0,1.0,0.0,0.0
896,13,"I thought so too , but they put green apples over red ! I 'm so confused !",3.0,2020-08-18 09:09:21,138.0,0.212,0.788,0.0,-0.6779
897,14,... tomatoes are used to demonstrate coordinate planes ? Please elaborate .,7.0,2020-08-18 04:50:06,138.0,0.0,0.827,0.173,0.3182
898,15,Hmm that 's true and indeed weird . There are `` green apples '' that are n't tart though like Golden Delicious maybe OP was thinking of it instead of Granny Smith . Idk .,3.0,2020-08-18 09:48:34,138.0,0.125,0.719,0.156,0.509
899,16,"The whole chart , I mean . I meant to reply to the whole thread and botched it apparently . The idea is is to describe where the fruit lays and no one can really do it without an actual measurement system like the coordinate plane .",4.0,2020-08-18 05:35:35,138.0,0.044,0.905,0.05,0.0772
900,0,Insert earrape user national anthem,1.0,2020-09-12 07:11:19,139.0,0.0,1.0,0.0,0.0
901,0,Abigail is a career . She ’ s been training her whole life for this .,106.0,2020-08-17 04:11:47,140.0,0.0,1.0,0.0,0.0
902,1,I wish there 's a mod that would let Vincent or Jas win once in awhile .,66.0,2020-08-17 04:21:47,140.0,0.0,0.698,0.302,0.7579
903,2,I found a single egg my first run .,18.0,2020-08-17 05:34:03,140.0,0.0,1.0,0.0,0.0
904,3,"Nah , easter in Acnh is where instead of cake , everything turns into fucking EGGS",50.0,2020-08-17 03:30:42,140.0,0.085,0.915,0.0,-0.1027
905,4,I love how the original post on the ac subreddit has a bunch of comments talking about who the best bachelor is ( although no one mentioned Harvey ),14.0,2020-08-17 06:40:35,140.0,0.058,0.66,0.282,0.8591
906,5,You can ’ t beat me Abigail .,3.0,2020-08-17 10:52:36,140.0,0.0,1.0,0.0,0.0
907,6,I ’ m married to Abigail in one of my files and I beat her in the egg hunt . She then did not use the “ come to bed I turned the electric blanket on ” line for a while .,1.0,2020-08-18 02:32:00,140.0,0.0,1.0,0.0,0.0
908,7,5/10 for being wildly inaccurate : They 're not all wearing Vault-suits .,-2.0,2020-08-17 12:04:57,140.0,0.0,1.0,0.0,0.0
909,8,Fish ? Nope it 's an egg !,24.0,2020-08-17 03:57:43,140.0,0.0,1.0,0.0,0.0
910,9,"You undercook fish ? Believe it or not , egg .",18.0,2020-08-17 05:42:20,140.0,0.0,1.0,0.0,0.0
911,10,"Seriously , though . Or having a bunch of eggs falling on your head .",6.0,2020-08-17 04:59:10,140.0,0.202,0.798,0.0,-0.3182
912,11,Harvey needs more love honestly,8.0,2020-08-17 09:49:49,140.0,0.0,0.279,0.721,0.8304
913,12,You overcook fish ? Right to egg .,12.0,2020-08-17 11:06:31,140.0,0.0,1.0,0.0,0.0
914,0,My brain was more confused about EATING it .,17.0,2020-08-17 09:27:33,141.0,0.245,0.755,0.0,-0.3804
915,1,He asked me for a gold bar `` if it 's not too difficult '',5.0,2020-08-19 00:35:17,141.0,0.0,0.869,0.131,0.2755
916,2,It always trips me up whenever Linus asks for stuff and gives you THREE HUNDRED GOLD,3.0,2020-08-26 21:06:01,141.0,0.0,1.0,0.0,0.0
917,3,doesnt he have a lil tv in his tent ?,3.0,2020-08-19 10:11:18,141.0,0.0,1.0,0.0,0.0
918,4,crunch,3.0,2020-08-18 05:47:29,141.0,0.0,1.0,0.0,0.0
919,5,Maybe he just wants the can,1.0,2020-08-21 07:05:31,141.0,0.0,1.0,0.0,0.0
920,6,what is it connected to ?,2.0,2020-08-25 09:10:53,141.0,0.0,1.0,0.0,0.0
921,7,Linus is the wizard 's friend ...,1.0,2020-09-04 05:47:12,141.0,0.0,0.652,0.348,0.4939
922,0,this is so underrated,2.0,2020-09-01 01:37:09,142.0,0.0,1.0,0.0,0.0
923,0,Or when you milk already milked cow ...,64.0,2020-08-16 08:30:52,144.0,0.0,1.0,0.0,0.0
924,1,I 'm most disturbed when you accidentally try to milk something that does n't produce milk . * What 's making that tugging sound ? *,53.0,2020-08-16 10:04:10,144.0,0.181,0.819,0.0,-0.6478
925,2,Autograbbbers are well worth the investment just for this,64.0,2020-08-16 09:21:27,144.0,0.0,0.808,0.192,0.2263
926,3,Or facing the wrong direction when charging the watering can,15.0,2020-08-16 10:32:41,144.0,0.256,0.744,0.0,-0.4767
927,4,"There 's a mod that fixes this . Better Ranching . Stops the animation for failed milking/shearing attempts , and puts an indicator over animals that need to be petted , milked , or sheared .",16.0,2020-08-16 11:09:33,144.0,0.12,0.809,0.071,-0.25
928,5,I hate barn animals in Stardew tbh . Literally waiting until I can get an auto grabber to buy a barn in my current playthrough .,7.0,2020-08-16 12:16:11,144.0,0.129,0.871,0.0,-0.5719
929,6,Hey I just watched interstellar,3.0,2020-08-16 09:43:09,144.0,0.0,1.0,0.0,0.0
930,7,Did n't read the sub name Safe to say I was very confused,2.0,2020-08-16 18:02:17,144.0,0.157,0.667,0.176,0.079
931,8,This is why I use the “ Faster Animations ” mod !,1.0,2020-08-28 16:44:18,144.0,0.0,1.0,0.0,0.0
932,9,pp,20.0,2020-08-16 11:04:50,144.0,0.0,1.0,0.0,0.0
933,10,And the frustration of never remembering which day you milked the goats ...,16.0,2020-08-16 10:25:35,144.0,0.205,0.795,0.0,-0.4767
934,11,Sadly you need to be level 10 farming for that,9.0,2020-08-16 09:51:26,144.0,0.237,0.763,0.0,-0.4215
935,12,Wait autograbbers milk too ? ? ? 🤦‍♀️🤦‍♀️🤦‍♀️,3.0,2020-08-16 12:39:05,144.0,0.0,1.0,0.0,0.0
936,13,First thing I bought after reaching level 10 for my barn and stable lol,2.0,2020-08-16 10:43:52,144.0,0.0,0.723,0.277,0.5574
937,14,I wish I could use that but I play on my Switch : (,11.0,2020-08-16 11:54:18,144.0,0.0,0.708,0.292,0.6059
938,15,"Or , for a more general version , Faster Animations",1.0,2020-08-28 16:45:00,144.0,0.0,1.0,0.0,0.0
939,16,for the first time ?,2.0,2020-08-17 03:35:10,144.0,0.0,1.0,0.0,0.0
940,17,That 's what I 'm afraid of,7.0,2020-08-16 11:46:01,144.0,0.0,1.0,0.0,0.0
941,18,"Pick even or odd days , use it for mushrooms as well . Then just stay consistent .",10.0,2020-08-16 12:22:33,144.0,0.119,0.881,0.0,-0.3182
